titulo|link|contenido|fuente
Sin deportaciones masivas de hidalguenses, tras política migratoria de EU|https://news.google.com/read/CBMiugFBVV95cUxPdWd6UXhpeVBXdzFQMTcwX21zbGZnLXNibFNBck9NUTMteHFtME94Q3BoMUZIX3cxUmVkT0xtSnNqZ3lqX0pDZnlvTVQxOUltU0U1cXdrWGV5cXlwWUpQbFpLX3F0b3o1Y1lKOWdpcXoyVVFLLXdrVmh6bXlQMFpVUzdfZ1lSM0xMVjhqbkRnc1RrMllxQUFBb0tpY1JQbEZlaTJUaW5TWHFMNHU2TkhsX3F3S2YyNjk0WHfSAc4BQVVfeXFMTWtPVEQ2YmRNNTV1ZWtoaFc3bHJ6cERvUV85YVo1c25FZ2F5b1JpXy1rWkxsZEYzcXVLdW5KcmFsdUhmb0lZR0U0elNFOHpYR2dWa284NGp3a0JqWXozUTBmdl9xZ3JKeU5fSXhFZG55MnVRVUpXQkM2WjZyZXhrdXpEZ2I1bHJlTkxudmlXT2MtWnA1VmsxbWNOM1JNUHUwaE03b2VQbzB4TEZuaUxaN0FSSTVlMzRSLXByT05BcFJkWE8tWUZjQ1Q0RmpYSXc?hl=es-419&gl=US&ceid=US%3Aes-419|Entre enero y febrero 590 hidalguenses que estaban en Estados Unidos o intentaron cruzar a ese territorio fueron devueltos a Hidalgo. Por el número, la entidad es el séptimo lugar en el país mayor incidencia de repatriaciones, pues las listas la encabeza Chiapas, Oaxaca y Michoacán.
Las estadísticas del Instituto Nacional de Migración INM reflejan que al menos en la entidad hidalguense las devoluciones se mantienen a pesar de la política migratoria que se anunció con la llegada del presidente Donald Trump.
Dichas numerarias indican que durante enero 370 hidalguenses fueron repatriados, lo que significa un incremento frente a los 320 retornos registrados en el primer mes, pero de la anualidad pasada.
Para el mes de febrero, 220 migrantes fueron expulsados de Estados Unidos hacia Hidalgo; sin embargo, esta cifra es menor frente a los 439 devueltos el año anterior.
De manera global en 2024 las repatriaciones ascendieron a 759 casos que es una cantidad mayor a las 590 reportadas en el primer bimestre de 2025. De acuerdo con Francisco Garduño Yáñez, director del INM, de vista por Hidalgo, la entidad está en el lugar siete de todo el país.
A decir de Manuel Enrique Aranda Montero, director de Atención al Migrante a nivel estatal, las cifras se mantienen estables con respecto al año pasado.
Para el periodo vacacional de marzo al mes de abril, Aranda Montero estimó la llegada de 4 mil a 5 mil migrantes hidalguenses, pero también reconoció que el número podría variar por las condiciones migratorias de Estados Unidos.
|El Universal
¿Política exterior feminista en la Cancillería mexicana?|https://news.google.com/read/CBMieEFVX3lxTFA2dmxVcmV3UFhRejRzcDE0NVZDRWZmQkZtX3BGWktYdjlWWHR3a2k2QW1vV3lveVlFN3NCNlgxTlc5cF91S0JNOUdHSGxIZHp6ZGN1NXFjOWtFTXJrWHl6dDFXMVcycnEzdlFOWm45cm54VDNCQzN6ZA?hl=es-419&gl=US&ceid=US%3Aes-419|No, nos confundamos. El anuncio de que dos terceras partes de las vacantes que se abren para al concurso de ingreso al Servicio Exterior Mexicano (SEM) serán para mujeres, no da como resultado en automático una política exterior feminista. Que ya era hora, sí. Que ya se habían tardado, también. Que aprovecharon el momento de usar el mes de marzo para dar el anuncio, cuando este mes es considerado como el mes de la mujer, quizás. Pero de eso a afirmar que ya con esto se avanza hacia una política exterior a favor de la mujer, está muy lejos.
 
Agradezco mucho a quienes me han escrito en privado (por diferentes canales de comunicación) para proponerme a que aplique a dicha convocatoria. Pero mi respuesta en privado, la hago pública: “no me interesa aplicar”. Yo ya demostré que, por mis propios méritos, mi capacidad intelectual, mis habilidades blandas y mis conocimientos de idiomas, geografía nacional e internacional, historia de México y mundial, economía, derecho nacional e internacional, entre una gran serie de otros temas, sí aprobé las etapas uno y dos para este examen en verano de 1998. Y como lo externé hace un par de años atrás en la red social X (antes Twitter), fue devastador que un embajador misógino fuera miembro de la Comisión de Ingreso al SEM ya que nos negó la oportunidad a mí, a dos de mis compañeras de la Maestría en Estudios Diplomáticos del Instituto Matías Romero (IMR) y a quién sabe cuántas mujeres más. Nos dijo en la entrevista que forma parte de la tercera etapa: “usted ¿qué hace aquí?, ¿qué no entiende que las mujeres no sirven para la diplomacia mexicana?, usted algún día se va a embarazar y no nos va a servir, váyase”. Sí, me corrió del proceso de entrevista sin haberme preguntado absolutamente nada de lo que me tenía que cuestionar en términos disciplinares. Esto fue una profunda agresión verbal hacia mi persona por ser mujer. Jamás olvidaré cómo retumbaron mis oídos al escuchar estas palabras, mi rostro sonriente se desdibujó, y ninguno de los otros dos integrantes de dicho grupo de entrevista dijeron nada. Al contrario, su silencio fue la luz verde a ese atropello por el hecho de ser mujer. Recuerdo que ellos eran: una funcionaria de piel muy clara, cabello negro, cara redonda, usaba lentes y su nombre era Blanca. El otro era un embajador alto, apiñonado claro y si mal no recuerdo, de nombre Francisco. Ambos fueron cómplices de esta bajeza durante el proceso de ingreso al SEM en 1998.
 
Pero el miserable que nos truncó la posibilidad de desarrollarnos en una carrera diplomática a varias mujeres, siguió en varias embajadas y otros cargos públicos. Ahora ya está retirado, pero hizo mucho daño. ¿Su nombre? Claro, lo pongo en mayúsculas: JORGE ALBERTO LOZOYA LEGORRETA, para que no se le olvide a nadie y menos a quienes se jactan de presumir que ya con esta cuota de 66 mujeres, se “avanza” en la paridad de género en el SEM. Que no se les olvide a aquellos embajadores en retiro que se atrevieron a defenderlo en un chat de Whatsapp que tienen y que hasta osaron cuestionar dicha denuncia pública minimizando mi experiencia. Que no se les olvide al interior y al exterior del SEM la manera en que varias mujeres han tenido que luchar contra el acoso laboral, los machismos y las misoginias. Que no se les olvide a quienes son testigos de tantas arbitrariedades hacia mujeres cuyas denuncias no prosperaron por el simple hecho de tener una vagina y no un pene.
 
Este terrible hecho no solo se trata de mí sino de todas aquellas mujeres que han sufrido maltrato y atropellos de cualquier índole y de cualquier rango en las dos ramas del SEM. Las cuotas impuestas a veces justo son para maquillar las desigualdades de género. Imponer 66 lugares puede ser una mera fachada de meter a quienes, aunque no tengan méritos, ingresen, con tal de cubrir la cuota y pararse el cuello de que hay equidad de género. No habrá de sorprendernos que en este concurso entren mujeres que, aunque no tengan las credenciales necesarias, sí tengan la afinidad de la ideología política “requerida”. ¿Cuántos personajes vemos de nombramientos políticos en varias embajadas y consulados que se convierten en una indignación para los mexicanos y las mexicanas?.
 
Seguramente habrá quienes estén en desacuerdo con estas líneas que escribo porque creen que en verdad nuestro país está avanzando hacia una política exterior feminista a través de estos 66 lugares. Pero les respondo anticipadamente, a mí no me cuentan. Lo que yo viví mientras estudié en el IMR no debe minimizarse, sobretodo si le sumamos (como cereza del pastel) que el Embajador Agustín García-López Loaeza jamás se dignó a recibirme en su oficina para darme retroalimentación de mi tesis. Fue el propio IMR quien le solicitó -por escrito con carta firmada de la Embajadora Olga Pellicer en calidad de directora general- ser el lector de mi proyecto de investigación para graduarme de la maestría y nunca me recibió para darme comentarios, observaciones y/o mejoras.
|Opinion 51
Plataformas digitales, política y desinformación|https://news.google.com/read/CBMisAFBVV95cUxOQ28wVnk3b1cyY1hIOWpvQURrem10U2hOT3FOWjVYZVVFb0E3VmJQWFdOaUE0cE9VVVF1WmplejNxeHV1NVNWMlRjcHhJdnJaWFpTRHVqNGMxUFJvZERVeUdLdVdEM0FEcjE1TjhQMTZzZUx0Y1FzUG9YV1VRMm03S0dxTndkbzVQRFRZQUF0aW9hSk5PRkpwQkpoRHgyajZCbzlaTW4weEQwRGlpa1pUUw?hl=es-419&gl=US&ceid=US%3Aes-419|Elon Musk se asignó un papel importante que tiene efectos que podrían permear más allá de los Estados Unidos: la manipulación de las audiencias digitales para reducir la capacidad de agencia de la resistencia civil. El cargo que Musk ocupa en el gobierno de Donald Trump le da facultades para recibir información valiosa sobre el comportamiento de los usuarios de X (antes Twitter); no solo datos personales, también tiene acceso a patrones de comportamiento que se reflejan a través de las opiniones que se emiten en momentos cumbre de un evento. El contenido que consumen los usuarios de redes sociales, sobre todo en temas de coyuntura política, es clave para entender el fenómeno de manipulación mediática.
Los individuos a veces basan sus opiniones en la información que les resulta más accesible, sin consideraciones ampliamente deliberadas, la percepción de un encuadre comunicativo en específico puede ser más fuerte si la relevancia de la narrativa es más atractiva. Es decir, si los individuos consideran que el suceso es trascendental para la agenda pública, serán más susceptibles a los encuadres narrativos que encajen con sus ideas previas, y podrán hacer sus propias evaluaciones. Entonces, las narrativas más fuertes son aquellas que emergen de la discusión pública como las mejores posiciones ideológicas que se enfrentan para evaluar un evento de agenda pública. Pero las narrativas construidas alrededor de un valor en particular -como la democracia o la transparencia- no funcionan universalmente. La explicación detallada, o contexto, es una narrativa sólida cuando se emplea en debates particulares sobre regulaciones económicas, por ejemplo, pero no son tan importantes para describir la animosidad política en periodos electorales. El factor clave de la manipulación en medios digitales como X, y en general en todas las redes sociales, es el tiempo. Los editores y jefes de información deciden sobre la marcha el formato que pueda ser más eficaz para una cobertura casi compulsiva de contenidos que son relevantes para el desarrollo del evento que surgió de forma repentina – o al menos parecería que nadie se lo esperaba-. Aquí viene el giro en la historia, y para esto es importante explicar la diferencia entre las noticias episódicas y las noticas temáticas/especializadas. Por la generalidad y alcance de las audiencias en redes sociales, las prioridades para reportar cambian de manera constante porque los acontecimientos recientes se mueven a una velocidad más alta que el resto de los eventos previamente considerados. Por otra parte, las noticas temáticas (o especializadas) se cubren en formatos diseñados para formatos más largos, en los que disponen de más tiempo para investigar los eventos como si fueran arcos narrativos. Las noticias temáticas son contenidos de largo aliento -en los que hay muchas horas y recursos dedicados a la investigación del suceso- son vistas como un problema social al que se le atribuyen situaciones de origen que pueden señalar responsabilidad hacia instituciones o actores políticos, deficiencias en los procesos de gobernanza, o simplemente describen la idiosincrasia cultural de un lugar. Este tipo de noticias vive más tiempo que las episódicas, porque se construyen a través de narrativas que reflejan el contexto social, político y económico de los individuos más allá de las situaciones cotidianas que sortea la ciudadanía en su conjunto. Las noticias episódicas apelan a la empatía de las audiencias; mientras que las noticias temáticas tienen responsabilidades democráticas con la ciudadanía. La cobertura de noticias de coyuntura tiene una forma “espasmódica” en redes sociales, sin importar si se trata de “breaking news” o de temas especializados. Cada actualización sobre un tema que es tendencia en la agenda de medios representa un contenido, video, post o “tuit” que se comparte compulsivamente por las audiencias. Una vez que se publica una nota en redes sociales, es imposible retroceder su cause: este contenido se diseminará en el espectro de la plataforma digital con efectos irreversibles si se trata de contenidos desinformativos. Por ejemplo, cada vez que se publica alguna actualización sobre las amenazas arancelarias. Los retrocesos narrativos (los aranceles se aprueban, los aranceles siempre no van) no son seguidos puntualmente por toda la audiencia de medios digitales. Los usuarios de redes sociales tendrán actualizaciones según la eficiencia del algoritmo de la página inicial de la plataforma. Musk conoce de antemano cómo funcionan los mecanismos de desperdigamiento de la información en la plataforma que adquirió en 2023.
Aunque los medios digitales hagan el esfuerzo de actualizar en tiempo real las notas que perdieron vigencia, las audiencias con menos herramientas de alfabetización mediática seguirán inmersas en una narrativa subjetiva que es compleja de refutar. Aquellos usuarios que son muy apegados a X tienden a engancharse en discusiones estériles sobre temas especializados: entre más acumulen conocimientos técnicos, tienen más incentivos para sostener debates. El problema es que las discusiones que ocurren en X tienen el propósito de motivar actitudes políticas que ocurran en la vida real. El aparato de manipulación en redes sociales es efectivo para mantener a los usuarios el mayor tiempo posible interactuando en las plataformas digitales. Esta actividad alimenta procesos de desinformación que son instrumentalizados por organizaciones políticas que buscan obtener reacciones trazables de las audiencias. Es difícil saber si la manipulación en plataformas como X tiene fines políticos o económicos, pero es necesaria la inspección y posible regulación como ocurrió en Brasil el año pasado. Los usuarios también son ciudadanos con intereses específicos, y debemos promover la alfabetización mediática para la defensa de la democracia.
|msn
Gabriela Ivy, la lengua karateca de la política online|https://news.google.com/read/CBMikgFBVV95cUxQNnRweS1BeXUwUHd3LWVhRUkyTDZ3cDRWV0h2N2xFb0tYUlBTc0hRUEZSRjNvZHVjanlIVFdZTmdTeUkwODRxU2llSEJwMFRuemZEbEd5NnFlWUc0cnRXcGZpUFpTYy1aODNLY1hGVk5PUURyTXUzMWswLTM4N0VSQ2hTV3BzZ01jaWlhT1lkbmRkQQ?hl=es-419&gl=US&ceid=US%3Aes-419|Gabriela Ivy, influencer y politóloga, repiensa las tensiones en el campo popular y la necesidad de adaptarse al lenguaje digital actual. En su libro Zoon politikona, comparte su experiencia personal y el papel de las redes en la política.
Como lo afirma el nombre de su libro, Gabriela Ivy se define por la capacidad de ser con los demás: Zoon politikona (puntos suspensivos ediciones). Una categoría aristotélica, en este caso feminizada: la idea de que lo que define a los seres humanos está relacionado con vivir en sociedad y la habilidad de asociarse con objetivos compartidos. El ""Zoon politikona"" de Gabriela Ivy, influencer que educa a jóvenes libertarios, va mucho más allá de sus títulos -es politóloga-, es decir, que la teoría no está en primer plano, sino que habla de sus vivencias —y padecimientos— en los distintos momentos de la historia argentina y de su pulsión de calle. Fue estudiante y empleada precarizada a fines de los 90, “busca” en el 2001, y mujer trans semi-enclosetada en el marco de una familia muy conservadora, hasta que las olas y las leyes le permitieron empezar a pensar en vivir como quería y sentía. 
La necesidad de opinar sobre lo que pasa le viene de las vísceras. Y a la lengua kickboxer la tiene desde el jardín de infantes. Gabriela además trabaja en el universo digital y sabe cómo hablar con la fuerza, la frecuencia y la velocidad que imponen estos tiempos, pero siempre con los datos chequeados.
Zoon politikona, su primer libro, se lee en un fin de semana y es una suerte de bitácora de transición, que cuenta su devenir de género, pero también su devenir en “muy politizada” (o, mejor dicho, politikona). Las anécdotas de infancia y adolescencia, las fotos familiares, las pequeñas grandes luchas libradas en el terreno de la oficina o el tren que une José León Suárez con la Ciudad de Buenos Aires arman algo muchísimo más amplio que una biografía. En esta conversación con Página12, Gabriela casi no habla del pasado, sino del presente. Y entre chistes y autocrítica, deja asomar sensaciones de que, inevitablemente, hay futuro.
Como creadora del término “liberpijis” y gran catadora de juventudes de ultraderecha, te quiero preguntar: ¿en qué creés que se falló para que un porcentaje importante de jóvenes, no sólo en Argentina, sino en el mundo, hoy comulgue con ideas ultraconservadoras?
—Hay un problema para mí, y lo digo en plan de autocrítica. Una tendencia a quedarnos cómodos en nuestro grupo. Incluso en subgrupos, por ejemplo, dentro de lo que puede ser el peronismo o el campo popular. Y como casi no hay intercambio, cuando algún encuentro se produce es como si estuvieran hablando distintos idiomas. Pienso, por ejemplo, en la tensión entre el kirchnerismo entendido como un movimiento más progresista y el morenismo. Yo me crié en una casa conservadora en la que no se hablaba de política. Veo esto: veo cómo podés crecer, educarte y moverte quizás toda tu vida en un circuito en el que la politización es algo malo. Y lo que pasa con esos grupos tan partidizados, para los que están afuera, que fue mi caso durante mucho tiempo, es que se habla en un idioma en el que los demás se quedan fuera. Eso te hace llegar a conclusiones como “no me interesa la política”. Cuando en verdad sí podría interesarte, sólo que no te la están mostrando de una manera seductora.
Es difícil atraer a los no interesados desde un lugar condenatorio y tan estricto acerca de todo “lo que no”. ¿Eso querés decir?
—Había, pero también ahora hay, algo medio automático de que no se puede disentir. Que si decís “tal cosa no me parece”, por ejemplo, enseguida “sos gorila”. Si vas a decirle a todo el mundo que es gorila, no estás invitando al que no vota peronismo a que sí lo haga. Yo tardé años en entender exactamente qué era lo que estaban tratando de decir cuando me decían “sos gorila”. Pero no es la forma de dar la bienvenida a ningún lado. Siempre voy a bregar por los partidos o espacios que me resultan más afines, pero no puedo ser orgánica, o por lo menos nunca pude hasta ahora, porque eso muchas veces implica que me digan “a este reel lo podés subir y a este no”. Yo no lo acepto. Y además, también ya sé que hay muchos lugares a los que, por ser trava, no me invitan. Y bueno, el peronismo es un espacio que tiene su costado bastante machista.
Desde hace un tiempo se empiezan a escuchar mucho esas propuestas de volver a un peronismo doctrinario. Y en nombre de esa doctrina se habilitan ideas muy reaccionarias, homofóbicas, misóginas… se escucha mucho también la idea de que los feminismos se pasaron tres pueblos y que por eso ganó la ultraderecha. ¿Qué pensás de eso?
—La típica: la culpa es del progresismo; por pedir derechos. Resulta que una letra x en un documento desestabilizó todo un movimiento. Hay una noción de progresismo aislado de la realidad. Asocian al progresismo con algo “trolo”, lo supuestamente cobarde, quedado, superficial, que no se mete en terrenos económicos. Yo soy progresista, pero si tengo que salir a las piñas, salgo a las piñas. Es un chiste, no pego piñas. Pero se entiende… Se cree que por hacer cosas progresistas se deja de lado todo lo demás. Decir que es importante poder incorporar al mercado laboral a personas trans —que tienen una expectativa de vida promedio de 39 años— no interfiere con ninguno de los otros cambios estructurales que se quieran llevar a cabo.
Hay mucha resistencia también en lo que se suele llamar “campo popular” a hablar en el lenguaje del presente. Se podría resumir: ""nosotros somos el territorio, ellos las redes"". Como si fueran espacios tan fáciles de delimitar y como si uno fuera más verdadero que el otro. ¿Cómo te posicionás frente a eso, como creadora de contenido político?
—Supongo que mucha de esa gente se habrá dado cuenta de que hay que adaptarse a vivir en el 2025. Mucha gente se quedó en el peronismo de los años 50. Y eso se refleja en las cosas que pasan.
Contame un poco cómo funciona el mundo de los influencers y sus lobbies. ¿Qué dirías de esos canjes en política? Es fácil imaginarlos como mercenarios… promocionando lo que sea, sin blanquear encima que se trata de publicidad...
—Y… funciona mal. Porque la gente cree que circula muchísima plata, pero muchas veces es sólo por los sanguchitos —risas—. Si no nos vas a pagar, entonces tendrían que dorarnos mejor la píldora. Se falla mucho, para mí, en estrategia digital. Se crean cuentas desde cero con el propósito de comunicar una plataforma política, y es complejo lograr engagement, por más que compren seguidores para arrancar, y menos si no hay una cara visible. En lugar de hacer eso, no entiendo por qué no recurren a las cuentas de personas que ya tienen seguidores, y ya conocen su línea… Yo creería que lo mejor es ir por ese lado. En una época se usaba eso de auspiciar reels. Ahora casi no se hace.
""Yo entro con el humor, me permito ser misándrica. Si vos sos mata-trava, yo soy misándrica, ¡y nos divertimos entre todos!""
Te movés en un territorio difícil para una persona trans… ¿Qué reflexión hacés después de tantos años de trabajar en el mundo del software sobre las masculinidades en ese ambiente?
—Son varones que en general se criaron entre computadoras, videojuegos, sin salir mucho de sus casas, algunos hacen algún que otro deporte, pero no tienen grandes núcleos sociales. Se mueven en mundos casi exclusivamente masculinos. Los insultos homofóbicos son parte de la conversación de todos los días. Incluso aunque esté yo. Incluso aunque yo les caiga bárbaro. Fue difícil la transición en esos espacios. Más allá de que me aceptaban, me llevó muchísimo tiempo que me llamaran por mi nombre, por ejemplo. Yo siempre me moví entre personas hetero y siempre me llevé bien con ellas. Entro con el humor, me permito ser misándrica. Si vos sos matatrava, yo soy misándrica, y nos divertimos entre todos. Yo termino siendo más guasa que ellos y les termino redoblando la apuesta a todos. Ni hablar de todo lo que, te imaginarás, ese supuesto rechazo esconde detrás…
|Pagina 12
Andrónico: Se debe dejar de hacer política desde el papel de víctima|https://news.google.com/read/CBMiswFBVV95cUxNLXhuZHpvQWlUX3lEbkNRcFdqZU1UaXI5aU4tRV9aZTVDeGVxeU5wcWI2bUdwVzR1MTZHaFB3TXRKUHJHdUZRaXRKbDFySGpNanVPcC1tQ2o4eXlGeTNsNlhnXzNvNXJoZzgxYWhiYjlkeV9PLTY3RHFzTGV0VUhZQ1N3STBJa2Z6dUJjaEJONjB4dHhFNVBKZW5oRlg0UnN3RTBtTUJSQlkxeFZ0SGVrRUc0QQ?hl=es-419&gl=US&ceid=US%3Aes-419|Andrónico Rodríguez dijo que la prioridad política debería ser la resolución de la crisis por la escasez de dólares y combustibles en el país. 
El presidente de la Cámara de Senadores, Andrónico Rodríguez, afirmó que se debe dejar de hacer política desde el papel de víctima y afirmó que su prioridad no son las candidaturas.
“Seguimos haciendo política desde el papel de víctima o resentimiento, implementando prácticas tradicionales de venganza y revancha. Es algo que tanto la izquierda como la derecha lo han tomado tan serio, que ahora para los de la derecha la solución del país es eliminar a los masistas, de un lado contra el Gobierno; desde el lado del Gobierno, contra Evo (Morales)”, dijo en conferencia de prensa el martes.
Andrónico Rodríguez
El legislador chapareño, formado políticamente bajo el ala del expresidente Evo Morales, no se refirió a alguien en específico. Sin embargo, dijo que algunos actores políticos están en una pelea “tan innecesaria dejando de lado los intereses más importantes que el pueblo”.
Así, Rodríguez se refirió a la “guerra política” entre el oficialismo, la oposición y la “nueva oposición”, como denominó el Gobierno al evismo.
Reclamó de los actores políticos un compromiso para trabajar por los problemas que enfrenta el país, como la escasez de combustibles y de dólares, y el incremento del precio de los productos de la canasta familiar.
Candidatura
Por otra parte, el titular del Senado se refirió a los rumores sobre su eventual candidatura a las elecciones generales de agosto de este año y dijo que su prioridad, por el momento, es la función pública y la agenda legislativa, específicamente.
“Yo he mantenido mi posición. En ningún momento dije ‘voy a ser candidato; ahora no voy a ser candidato (o) ahora voy a ser candidato’. Yo estoy cumpliendo una función pública, cumpliendo una agenda legislativa; mi prioridad no son las candidaturas”, dijo.
Sin embargo, agradeció a los sectores que le expresaron su respaldo y hasta lo proclamaron como candidato a la Presidencia. “Sin duda, son importantes las elecciones generales; para ello, necesitamos estabilizar relativamente el tema de la crisis económica, la falta de carburantes y dólares, finalmente”, apuntó.
Prioridad
Dijo que la prioridad política debe ser la resolución de esos problemas y que en su momento “se tomarán las decisiones, la dirección y el objetivo claro desde el Tribunal Supremo Electoral (TSE) cuando se convoque a las elecciones generales”.
Rodríguez negó varias veces ser candidato del Trópico de Cochabamba, pues Evo Morales se declaró candidato único del “bloque popular” y el senador se sometió “orgánicamente”.
Sin embargo, varios dirigentes dijeron que la decisión debe ser orgánica y que tanto Morales como Rodríguez deben “acatar” lo que los dirigentes y las bases dispongan.
|La Razon
