titulo|link|contenido|fuente
Estamos sembrando semillas de esperanza y para mí eso es lo principal.
Tal vez ahora toda la transformación, todos los sueños que tenemos, no los podamos hacer.
Transformar 500 años de exclusión, marginación y racismo de un sistema que sigue siendo colonial no se logra de la noche a la mañana.
Y estar frente al Ministerio de Igualdad ha sido de las tareas más retadoras e importantes.
La inequidad y la desigualdad es uno de los problemas estructurales de la nación y trabajar para cerrar esas brechas y generar oportunidades siempre es el camino correcto.
Le entrego a Colombia un ministerio creado con 24 programas maravillosos que ya transforman vidas y territorios.
Programas como Hambre Cero, que llevan alimentos a regiones como el Catatumbo, el Chocó o Bolívar.
O como Agua es Vida, llevando agua al Pacífico colombiano, a la costa nariñense, al Chocó, al Caribe.
Ahora espero que el nuevo ministro (Carlos Rosero) implemente estos programas completos y establecidos y que el Congreso apruebe la ley que garantice su continuidad, aunque eso ahora no está en mis manos.
Trabajar por la equidad es una necesidad para Colombia y para el mundo.
Y en el exterior, pude fortalecer relaciones con África, con el sur global, que gobiernos anteriores habían olvidado y veo importante seguir tejiendo.
También hemos trabajado en la necesidad de que todos los gobiernos nos articulemos en función de que una economía se ponga al servicio de la vida y que enfrente los desafíos del cambio climático.
Hemos hecho un esfuerzo como gobierno para mostrar otro rostro de Colombia como país, distinto al de ""Colombia y coca"" que antes se veía.
Una de las cosas que dijo en el Consejo de Ministros televisado a nivel nacional que no le parecían bien era el rol del actual ministro de Interior, Armando Benedetti.
Él estuvo desde el comienzo en la campaña con Petro. ¿Por qué tarda casi tres años en hacer público su descontento?
Soy mujer y asumí mi tarea aquí, en el gobierno, de liderar las políticas para las garantías de los derechos de las mujeres.
Y como mujer que ha vivido las violencias estructurales en este país, no puedo guardar silencio frente a las denuncias por violaciones a los derechos de las mujeres, sobre todo por violencias basadas en género.
Por lo menos yo no tenía información de esa situación.
¿Se refiere a las denuncias de algunas mujeres contra Benedetti?
Exactamente. Me refiero a las denuncias que se expresaron públicamente.
Sobre eso, por supuesto, yo no soy la juez.
Tienen que ser los entes competentes quienes esclarezcan estos hechos, pero como vicepresidenta tengo que manifestar mi rechazo a cualquier tipo de violencia, venga desde donde venga contra las mujeres, y es lo que he hecho.
También manifesté que respetaba la decisión del presidente.
Aunque tengamos posturas diferentes sobre esa situación, he respetado esa decisión y sigo en mi papel como vicepresidenta, cumpliendo el mandato que me dio el pueblo cuando nos eligió.
En su opinión, ¿qué importancia tiene Benedetti para Petro, al punto de que origina una crisis en el gabinete y que de cierto modo impulsa la salida de otros ministros muy fieles a al presidente como la extitular de Ambiente Susana Muhamad?
Bueno, esa es una pregunta que evidentemente no soy yo quien tiene que responder.
Es una pregunta que tiene que responder el presidente. Él sabrá cuál es la importancia del hoy ministro de Interior dentro del gobierno.
En lo que a mí respecta: venga la violencia de donde venga, siempre la voy a rechazar.
Usted forma parte del gobierno del cambio. Me gustaría que reflexionara sobre qué ha cambiado y qué no.
Creo que ha cambiado el miedo a ocupar los espacios de poder. En tiempos pasados era imposible que un hombre como Petro o una mujer como yo se atrevieran a disputar el poder en este país.
Ha cambiado el enfoque de dónde se invierten los presupuestos de la nación, que antes al gobierno se le miraba como un dios, que se pensaba imposible que un presidente o una vicepresidenta llegara a los rincones y territorios más excluidos.
Y no es solo la presencia física, sino que llegamos con inversión para transformar las realidades de esas comunidades.
¿Qué más ha cambiado? Yo creo que la política en términos de la visión de género.
Creo que los avances de crear instituciones a nivel nacional, que se piensan en la población LGTBIQ+, en la población con discapacidad, en pensar presupuestos paras esas poblaciones, ha sido un cambio.
También pensar en una sociedad del cuidado.
Nosotros hemos vivido el conflicto armado y sido víctimas de una política de muerte.
Hoy, reconstruir ese tejido social de los saberes comunitarios, de las parteras, de las madres comunitarias, y decir que eso es lo que tenemos que aprender, mientras desaprendemos esa cultura de muerte que se nos ha impuesto, es parte de la transformación.
Por supuesto, tenemos desafíos como el logro de la paz, poder silenciar los fusiles, abrir las puertas de nuestro país maravilloso.
Es parte del camino que tenemos que seguir andando, pero no perdemos la esperanza para que la paz también sea referente para el mundo.
Pero el mismo Petro reconoce que la mayoría de promesas están incumplidas.
Los desafíos que tiene este país son demasiado grandes.
Lograr cerrar las brechas de desigualdad e inequidad es el desafío mayor que tiene Colombia. Somos de los países más desiguales e inequitativos del planeta.
Puedo decir que gran parte de las causas del conflicto armado y la violencia tienen que ver con la inequidad y la desigualdad histórica a la que ha estado sometida la sociedad.
Uno llega y quiere tener una varita mágica para al otro día ya haber hecho esos cambios, pero tampoco pasa así porque también hay unas estructuras ya establecidas para que nada cambie y que cuesta mover.
A veces no se logra esa transformación.
Sin embargo, este es el primer gobierno progresista, de izquierda, que llega al poder después de toda una vida de Estado-nación y, por supuesto, cuatro años no son suficientes para lograr el cambio necesario.
A qué estructuras se refiere, si puede ser más específica.
Las estructuras coloniales, las estructuras políticas mismas, el sistema mismo... es algo que no se transforma de la noche a la mañana.
Nosotros nos hemos encontrado con leyes que son una barrera para los avances de la transformación que hemos planteado.
Algo que sí cambió, al menos frente a la administración anterior de Iván Duque, fue la relación con Venezuela. Se adoptó un enfoque más neutral y se reabrieron las fronteras.
Pero este gobierno también ha sido criticado por no condenar con la suficiente fuerza lo que pasó durante el proceso electoral del 28 de julio de 2024, que acabó con Nicolás Maduro tomando posesión en enero, a pesar de las denuncias de la oposición de que las actas indican que Maduro no ganó las elecciones.
¿Cuál es su posición?
Mire, el presidente se ha manifestado sobre Venezuela y ha planteado lo que él considera que debe ser.
Sobre eso, ¿yo qué le puedo decir?
Nosotros hemos vivido una barbarie y lo último que podemos hacer es heredársela a un país hermano por no tener una relación.
Hemos recibido a muchos venezolanos migrantes, como en su momento muchas personas, con la violencia que ocurrió aquí, también migraron a Venezuela.
Hoy está en juego la vida de la gente, el bienestar de un pueblo.
Tenemos que hacer todos los esfuerzos necesarios para que el pueblo venezolano, por lo menos, no caiga en una guerra que sabemos a veces dónde empieza pero no dónde termina.
Colombia todavía paga el precio de una guerra que empezó por disputas políticas y hoy son millones de colombianos y colombianas los que han tenido que irse del país, huyendo de la violencia, y son miles de colombianos que han desaparecido o han sido asesinados en una guerra que todavía no sabemos cuándo va a parar.
No se trata de izquierda o derecha, sino de derechos humanos y vidas.
Creo que las posturas del presidente han estado en ese sentido.
¿Por qué se fortaleció la relación? ¿Quién estaba perdiendo?
Estaba perdiendo la gente, las familias que están en las fronteras entre Colombia y Venezuela y que al final son la misma familia que pasan el charco, el río, el puente.
A pesar de esa postura, igualmente Colombia arrancó 2025 con una crisis humanitaria en la región del Catatumbo, fronteriza con Venezuela. Es uno de los múltiples focos de violencia que en este inicio de año me llevan a pensar que, a prácticamente poco más de un año de nuevas elecciones presidenciales, la paz total parece lejos de concretarse.
Cuesta mucho porque en este país se han lucrado de la guerra y ésta resulta siendo un fortín político.
Aquí hay quienes ofrecen guerra para luego, en elecciones, ofrecer seguridad. Han sembrado el miedo y la gente vota solo por un candidato que les garantice que no tendrán violencia.
Es un círculo vicioso: te ofrecen violencia y luego en campaña te venden paz y seguridad.
Así nos han mantenido como sociedad, sometidos a una violencia absurda que se ha instrumentalizado para someter al pueblo.
Eso no puede seguir. Este gobierno no puede renunciar a los sueños de paz.
Por supuesto, las fuerzas armadas y policías, como ya lo dijo el presidente, tienen órdenes de proteger a la sociedad civil y garantizar la seguridad nacional, pero hay que seguir haciendo todos los esfuerzos de la paz.
Usted también ha vinculado las dificultades para conseguir la paz con la política antidrogas de Colombia. De hecho, ha apostado y sugerido legalizar ciertas sustancias y/o cultivos.
Pero esto siempre fue una línea roja con Estados Unidos, clave en la lucha contra las drogas en Colombia.
Ahora que Donald Trump tiene un discurso más proteccionista y aislacionista, y que ya el pasado enero la relación entre EE.UU. y Colombia estuvo bajo mínimos con la polémica de los deportados colombianos, ¿es el momento para que Colombia adopte otra política antidrogas?
Bueno, esa es una decisión que está en cabeza del señor presidente y, por supuesto, no puedo pasar por encima.
Él lo ha dicho de frente: el camino para acabar con la violencia, el conflicto armado, los cultivos ilícitos, la droga, que han sido el incentivo para generar violencia en muchos territorios, es transformar esa economía ilegal hacia una legal.
El presidente ha insistido en que el Congreso saque una ley que regularice el uso de la hoja de coca y la de marihuana.
Este gobierno ha tenido la voluntad de encontrar otros caminos posibles para enfrentar estos problemas.
La política de interdicción ha sido efectiva en términos de lucha contra el narcotráfico, de coger los eslabones grandes de la cadena del tráfico de drogas.
Antes, a quien se golpeaba era al campesino, al pobre que estaba en el territorio.
Este gobierno ha cambiado ese enfoque, poniéndolo en las industrias del tráfico de drogas transnacional.
Pero resolver el problema estructural implica el diálogo con varios actores y EE.UU. es un actor clave en esa discusión.
¿Y cómo se presenta ese diálogo?
Llevamos muchos años planteando una guerra contra las drogas que ha sido ineficaz, sin resultados, y eso muestra que hay que avanzar hacia la legalización, quitar el incentivo perverso que se hace a costa de la vida de la gente.
América Latina ha perdido un millón de personas asesinadas en el marco de esas economías ilícitas y hay un sinnúmero de gente encarcelada o judicializada.
Hemos perdido mucho como región por este flagelo del narcotráfico.
Yo creo que hoy toca seguir haciendo los esfuerzos para que se encuentren caminos que resuelvan esta situación y, lo digo como opinión personal, el camino es la legalización.
Queda poco más de un año para nuevas elecciones. ¿Ya pensó si va asumir algún rol para la próxima campaña, si piensa en alguna candidatura presidencial o una nueva fórmula?
(Ríe) No. Dije que a mí me eligieron para cumplir un mandato y espero terminar mi periodo.
Y espero que quienes lleguen a la presidencia sean los más idóneos: gente que piense en la paz, en la justicia y en el bienestar de todos los colombianos y colombianas.
|BBC News
Las pequeñas donaciones en la política no son el problema|https://news.google.com/read/CBMiwAFBVV95cUxNTXNITEg3SzRmOExneERNNHRoZDhQNHBtMjk3dGVWcmNJUEFoTldvZHUzeFIzUlJrWkpFaFBxM3JUZjFyaENnV1laRHVmNWMxSUZJc2RBNXlManJPVjNERkFiT2RJRzcweUtxNHM1RDJXeFZLSkpaVGY1VURRMmdpdnBnRE1nRGJkSGlZZ2ZKVjNKcjN1RnFhT3NWYkFMd3dLVWQtRERDTHFvdno5VHNiZ3plMVd6N0VUanNMcFBTTHM?hl=es-419&gl=US&ceid=US%3Aes-419|En las elecciones de 1896, Mark Hanna, el estratega de la campaña de William McKinley, hizo una broma que pasaría a la historia: “Hay dos cosas importantes en la política. La primera es el dinero, y la segunda no la recuerdo”. 
Una noticia reciente refleja la historia de nuestra nueva Época Dorada. 
La semana pasada, un montón de magnates acapararon los titulares cuando se reunieron a cenar. Organizada por el capitalista de riesgo David Sacks, la fiesta contó con la presencia de Elon Musk, el segundo hombre más rico del mundo; Rupert Murdoch (no se pierdan la cuarta temporada de Succession); Peter Thiel, que, casi por sí solo, metió a J.D. Vance en el Senado; Travis Kalanick, uno de los fundadores de Uber; y Michael Milken, a quien muchas personas de cierta edad recordarán como el “rey de los bonos basura” previamente encarcelado e indultado por Donald Trump.
Esta reunión se interpretó como una señal de agrado de Silicon Valley hacia Donald Trump y un giro hacia la derecha política en esa comunidad que posee una cantidad enorme y concentrada de riqueza y poder cultural. 
Este conclave revela algo importante sobre la verdadera historia del dinero en la política de los Estados Unidos.
Desde que la Corte Suprema efectivamente desregularizó el financiamiento de las campañas políticas en los Estados Unidos mediante la causa judicial Citizens United, ha comenzado una carrera entre el aluvión de pequeños donantes empoderados por la recaudación digital de fondos y los grandes donantes.
Las pequeñas donaciones acaparan la atención del público. Pero las donaciones anónimas, como las de Musk y sus amigos, han asegurado el poder mucho más de lo que pensamos.
Las pequeñas donaciones contribuyeron más de $4 mil millones en las elecciones federales de 2020, un importante aumento con respecto a 2016, cuando aportaron $1 mil millones. Se podría pensar que esta es una buena noticia. Sin embargo, dado que este aumento coincide con una polarización cada vez peor, ciertos expertos han culpado por el mal funcionamiento de la política estadounidense a todas esas donaciones de $10 y $20 que recibían algunos políticos.  
Un nuevo análisis realizado por mi colega del Brennan Center Ian Vandewalker destruye muchos de esos mitos. 
En primer lugar, si bien las pequeñas donaciones han aumentado, las megadonaciones han crecido mucho más. Tal como lo informó el Brennan Center el año pasado, en 2022 tan solo 100 grandes donantes aportaron el 60 por ciento más que todos los pequeños donantes en su conjunto.
Las grandes donaciones siguen haciendo polvo a las pequeñas. “En 2022, tan solo 21 donantes individuales y parejas contribuyeron, en total, $783 millones, muy por encima del total donado por los millones de personas que realizaron pequeñas donaciones”, apunta Vandewalker. 
Esos grandes donantes pueden tener una ideología tan extrema como los pequeños donantes. Numerosos políticos en su cargo, en especial republicanos, viven con el miedo de que venga un súper-PAC con miles de millones de dólares dispuesto a donar enormes sumas para vencerlos en las próximas elecciones. Los megadonantes ahora patrocinan a sus candidatos como si fueran caballos de carrera premiados. 
¿Y qué pasa con las figuras políticas polarizantes a las que les encanta ocupar el centro de atención, como la representante Marjorie Taylor Greene (R-GA), que en este momento se dedica a torturar al presidente de la Cámara de Representantes Mike Johnson (R-LA)? Es verdad que personajes como Greene atraen a los pequeños donantes con una marca política extravagante. Y lo mismo hacen otros agitadores políticos de izquierda. Pero la mayor parte del dinero de las pequeñas donaciones no se destina a los candidatos más extremos, sino a los más famosos.
El senador republicano Lindsey Graham (SC) y la representante demócrata Nancy Pelosi (CA), partidarios fervientes del establishment, han recibido sumas astronómicas de donaciones anónimas. Algunos donantes de todo el país aportan grandes cantidades de dinero a favor de quien sea que se presente contra el senador Mitch McConnell (R-KY) en cualquier contienda. 
La polarización política tiene muchas causas. Igual que la fragmentación del poder que ha hecho de la Cámara de Representantes una entidad especialmente ingobernable. En el cuarto de siglo que pasó desde 1998, el partido republicano ha elegido a siete presidentes de la Cámara; el partido demócrata, a uno.
Todas estas fracturas, que afectan principalmente a un solo partido político, surgieron antes de las redes sociales y la plataforma de recaudación de fondos en línea ActBlue y, por ende, no se las puede culpar por el auge reciente de las pequeñas donaciones. 
De todas formas, hay una forma de minimizar cualquier daño que ocasione un aumento repentino en las pequeñas donaciones e incluso, al mismo tiempo, reforzar la tendencia. El financiamiento público de las campañas políticas sigue siendo la mejor forma de garantizar que los políticos escuchen y respondan a las necesidades de la ciudadanía y no solo a las de sus donantes.
Un nuevo programa promulgado en el estado de Nueva York prevé un sistema que iguala y multiplica los fondos de las pequeñas donaciones siempre que estas provengan del distrito del candidato. Las leyes federales, como la Ley de Libertad para Votar (Freedom to Vote Act), deberían permitir la multiplicación de fondos solo para donantes del mismo estado. Eso ayudaría a que los políticos no estén tan alejados de sus propios electores. 
|Brenan Center
Los libertarios se ilusionan con llevarse la victoria política con la suspensión de las PASO en Buenos Aires|https://news.google.com/read/CBMi6AFBVV95cUxPeHpQV0t6QVJvS1luSUs3XzhZVTZicEh0MjdrSF9PTGNPenBwcnFmbVdWR0ljM3NBYmhReXRhQzd3dVhEcXF2M19VN25mSkp6NThDUWJnWE1rWUZEaEtEWXhLSi1sVWpCN0NDSWtUT0N5Zjdaekkya2lWLXRDM3FtczFQbmR5YWxaZEFUZnhzTmlITHFkbmZEaFN3UGtwaFlaUG8tZV94NWxCU2tFbWNEUElNM0lQbG9KMVdGUlJCWTJSekpfT3RLMkxyV1hycExXZ2tsaGdqUjJjR1NDTU1VUG1JS3o5aUNo0gGDAkFVX3lxTE1iVWdmX21BdmV3bkhNekl6cmpVYzhWRklXZW54QkwwOEV3X1Jqc2EtRkE0U05tRUJySEwtU3hBUHZUdVJJWThGZmhSTmF1VnpXSm9yUnZ1ZWxzYzJIQXhrTS05UFV6Y2ZwdEh6TUR1MGhYa0R3QWg5YVlXSzJkY1JxamxQVHJWVkZfaTdwVW1rNGExTFp2QjBzWFV0RTgyMnlQX2xFaGpPNU1icVI2NlFSbEtKd0ZfUGdBNkM5QzdLQWJJTUFzRnhySGVkZ0EwTUpyOTZJNTc2blBCSjFvamF0TlVMQTdvbWhhYU1DUDh0aGNOQW81OGxEOFdRbEJOaTVjbnc?hl=es-419&gl=US&ceid=US%3Aes-419|Pidieron una sesión especial en Diputados, que el presidente de la Cámara avaló y convocó para este jueves. Hay cinco proyectos para suspender las Primarias en el temario. Kicillof había pedido avanzar sobre las PASO y se necesitan 47 diputados para el quorum. El peronismo, cerca de entrar a un laberinto 
Este jueves podría haber novedades por la suspensión de las PASO en la provincia de Buenos Aires. Será desde el mediodía cuando la Cámara de Diputados abra el recinto para llevar adelante una sesión especial. La misma fue pedida por el bloque de La Libertad Avanza para tratar cinco proyectos cuyo objetivo es que -en consonancia con lo que votó el Congreso- este año no se lleven adelante las elecciones Primarias en territorio bonaerense. La suspensión de las PASO fue un reclamo que el gobernador bonaerense, Axel Kicillof, realizó a la Legislatura en la apertura de sesiones, el pasado 5 de marzo. Una solicitud que fue ratificada este lunes por el ministro de Gobierno provincial, Carlos Bianco. En esa ratificación, el funcionario apuntó a la Legislatura por la demora en la resolución. “Júntense y resuelvanló”, espetó. La falta de definiciones obligó a Kicillof a hacer la convocatoria formal para el 13 de julio a la espera de que el cuerpo legislativo finalmente baje las elecciones de candidatos. En este contexto, el bloque de La Libertad Avanza, que preside Agustín Romo, juntó las diez firmas y elevó un pedido de sesión especial. El encuentro podría materializarse este jueves, pero está atravesado por varios factores
Son diversas las condiciones que tienen que existir para que efectivamente este jueves se avance con la suspensión de las PASO. Más allá de ello, lo cierto es que los diputados de Javier Milei podrían dejar expuesta la interna del peronismo en lo que refiere al no avance legislativo para suspender las Primarias.
El presidente de la Cámara baja, el massista Alexis Guerrera, habilitó la sesión de este jueves. Para llevarse adelante, el bloque de Romo tiene que juntar el quorum, lo que significa el acompañamiento de 47 diputados y luego los dos tercios de los presentes para habilitar el tratamiento de los proyectos, ya que ninguno tiene despacho de comisión y se debe votar sobre tablas. En principio, tiene trece diputados de los propios, trece del PRO y tres de la Coalición Cívica. Una suma a la que podrían sumarse los llamados libertarios dialoguistas que se encuadran en la bancada Unión, Renovación y Fe, que tienen un bloque de nueve. Hasta ahí la cuenta da 35 legisladores. Faltarían 12.
Lo particular es que, en este caso, la avanzada de los libertarios, sería funcional al interés de Kicillof que empuja la suspensión de las PASO, pero carece de peso legislativo propio y sigue atravesado por la interna del peronismo en cada paso que busca dar en el terreno legislativo. Por estas horas corren versiones sobre qué hará el peronismo bonaerense este jueves.
En LLA admiten que si el peronismo no baja al recinto, será una victoria libertaria en alianza con el PRO, que este martes volvió a explicitar que las PASO en PBA deben suspenderse. ¿Qué sucederá en ese caso? Habrá una foto del recinto semivacío y ocupado solo con un sector de los bloques opositores sentados en sus bancas para suspender las Primarias, como lo pidió Kicillof, pero sin el número necesario para votar una ley alusiva.
“No descartamos ningún escenario”, aseguraban desde el sector libertario ante la consulta de Infobae. El radicalismo también balancea en la realización de la sesión especial. Partido en dos espacios, los legisladores que comanda el senador nacional, Maximiliano Abad, no bajará al recinto hasta tanto lo haga el bloque de Unión por la Patria y con todas sus expresiones: La Cámpora, intendentes, axelismo y Frente Renovador. Es decir, si el peronismo baja, la sesión puede avanzar.
En el bloque oficialista reinaban posiciones disímiles. Algunas fuentes parlamentarias aseguran que en realidad para lo de este jueves no habrá quorum, que la sesión se caerá y pasará todo para el 27 de marzo para tratar —ahí sí— el proyecto del massista Rubén Eslaiman que pide suspender las PASO y fue presentado el año pasado. “Es una buena iniciativa para trabajar”, dijo Bianco este lunes sobre el texto impulsado por el diputado del bloque de UP.
Sin embargo, esa iniciativa está dentro del temario que se habilitó para la sesión especial del jueves. “En la sesión que pedimos desde el bloque está el proyecto de Eslaiman. Es más fácil bajar el jueves, votar un dictamen de consenso y chau”, plantearon desde el bloque de LLA. “Casi toda la oposición va a bajar, si no se vota es culpa del peronismo”, aseguran en la bancada que preside Romo.
Además del bloque de la UCR que preside Diego Garciarena y responde políticamente a Abad, en la Cámara baja también hay un grupo de siete legisladores radicales que conforman el bloque Acuerdo Cívico UCR+GEN cuyas terminales principales son el diputado nacional, Facundo Manes y el senador nacional Martín Lousteau. Este bloque podría acompañar la sesión para suspender las PASO en consonancia al pedido de Kicillof. Pero la condición es que al menos los legisladores del bloque oficialista que hoy integran el espacio del gobernador llamado Movimiento Derecho al Futuro bajen y voten. “No vamos a sentarnos al lado de LLA para votar esto”, aseguraban este martes por la noche ante la consulta de este medio. Con los axelistas en el recinto la foto cambia. Pero de suceder eso, el movimiento chocará con la estrategia que plantean desde la gobernación, donde aseguran que la suspensión de las PASO, la estrategia electoral y el desdoblamiento debe ser una decisión en conjunto del peronismo bonaerense y no solo una determinación de Kicillof sin sus socios cristinistas y massistas.
Una foto semejante —con los axelistas y massistas votando y sin La Cámpora— sería la materialización de la ruptura. Son once los diputados y diputadas que estamparon su firma en el espacio MDF y podrían dar una muestra de autonomía en consonancia con lo que pide Kicillof. Así, nuevamente la interna se pone en tensión.
El bloque de UP tiene 37 integrantes. Hay once que forman parte del MDF, quince que responden al esquema de intendentes que integran el PJ bonaerense que preside Máximo Kirchner y el cristinismo, diez que forman parte del Frente Renovador y una diputada que responde a Patria Grande. Lo que resuelva el bloque de UP que conduce Facundo Tignanelli será determinante.
