titulo|link|contenido|fuente
Cabe destacar que, estas previsiones provocaron una caída en las acciones de las tres aerolíneas más grandes del mercado: Delta, American y United.
|AvionRevue
EE.UU-Panamá y Canadá-México, la política se cuela en las Finales de la Liga de Naciones|https://news.google.com/read/CBMi1gFBVV95cUxPTm9tWEFYMUp1S3Q0ZzUyQXc0LXpDbGR4VTFXNzl2LWw2dDkyZTEtVDB6Y0prcGNZNzU4aUpfRERrdFdfLTdpcDBzaElsS0NFc05pOW0ySldMa3pxV183NFR2c1lZcndJV1Q0UWUwRmFQNGdUR2lScUxkd0RqQVpiYkNzQUNTODZQMVdIZzFiMlhPRFo3RzZjc01xaWNKQktKX3BGXzNrdUQ3S2VKSWlUQl9lTHVxY0tYVkxCd0p6SGN2aUVWTVpyaEhwbUd3VGxyNW9rNlBn0gHwAUFVX3lxTE5GRzlHMUhUSEF1RG5veXRfbEhPVEtFb1pfUmN4ZV9vSkhLWTNBSWh1WDdrQnlId0NEX2FvU0VNWm1KU3hYelExRUt6ZWxiS01zeWxsY0ZpUFN5eUpCNHFMY3pXWF91eDFWRXJVQ0xYYWp6QXVTTnZBUndXakJXY0xsc1Y4aDV1cXRsaTlNYzdmdzJuZmdTSFo2ZHZGcGZIdU1tXzU2WXpXcUJ3Zkc2X1JhTHhQYkNjWGxhTklWTlh1c09XWHVQM1RwN1RLb09EUWRmc1pZV29iQjdoSVVrUk81QTFSdXhoZmJCaEhUSngzaw?hl=es-419&gl=US&ceid=US%3Aes-419|Nueva York, 19 mar (EFE).- Con la política exterior y los choques diplomáticos como telón de fondo, las Finales de la Liga de Naciones de la Concacaf se juegan a partir de este jueves con dos semifinales: Estados Unidos contra Panamá y Canadá frente a México.
El SoFi Stadium de Los Ángeles (California, EE.UU.), el hogar de Los Angeles Rams y Los Angeles Chargers de la NFL, acogerá el EE.UU.-Panamá a partir de las 16 horas (23 GMT) y el Canadá-México a las 19.30 (2.30 GMT del viernes).
La final se jugará el domingo también en el SoFi Stadium a partir de las 18.30 (1.30 GMT del lunes).
Campeón de las tres ediciones hasta ahora de la Liga de Naciones de la Concacaf, EE.UU. busca su cuarto título consecutivo en unas Finales marcadas en la previa por las connotaciones políticas dentro de la segunda presidencia estadounidense de Donald Trump.
Así, Trump ha subrayado en múltiples ocasiones su interés por retomar el control del Canal de Panamá, pero también tiene importantes frentes abiertos (inmigración, guerra comercial e incluso soberanía nacional en el caso de su vecino al norte) con los otros dos semifinalistas del torneo: México y Canadá.
Además, EE.UU., México y Canadá están a poco más de un año de organizar conjuntamente el Mundial de 2026.
En este contexto, el argentino Mauricio Pochettino, seleccionador de EE.UU., opinó este martes que no se debe ""mezclar la política y el deporte"".
""No es porque no quiera hablar, yo tengo mis ideas (...). El fútbol es fútbol y para mí se trata de que queremos destruir a Panamá, queremos destruir al siguiente y queremos ganar. Pero cuando digo 'destruir' me refiero en cuanto a deporte. Queremos ganarles"", dijo en una rueda de prensa.
""Creo que la motivación no puede venir de diferentes problemas políticos y diplomáticos (...). Tenemos que jugar por nosotros mismos, tenemos que sentirnos orgullosos de defender nuestra bandera y nuestro escudo. Necesitamos jugar por nuestro país pero siempre en el campo"", añadió.
Pochettino aspira a su primer título con el combinado de barras y estrellas. En la semifinal se medirá a una selección panameña bajo las órdenes del técnico hispano-danés Thomas Christiansen.
Panamá ganó dos de sus últimos tres enfrentamientos ante Estados Unidos (Copa Oro 2023 y Copa América 2024), pero perdió el último precedente entre ambos: un amistoso en octubre de 2024 ya con Pochettino en el banquillo.
Por su parte, la selección de México buscará su particular redención puesto que cayó en dos de las tres finales por el título de la Liga de Naciones frente a EE.UU., incluyendo la de 2024.
Antes de ello, los convocados por Javier Aguirre tendrán que doblegar a la Canadá de Jesse Marsch que fue la gran sorpresa de la última edición de la Copa América, donde alcanzó las semifinales y se despidió finalmente ante la Argentina de Lionel Messi.
El último partido entre México y Canadá fue un amistoso en septiembre del pasado año con empate sin goles. EFE
|infobae
Política internacional de Trump: Sembrar el caos y la distracción|https://news.google.com/read/CBMinAFBVV95cUxQcUM0YU5vVVFPaE1XNXRuc1NobWxrQ3d2UzJWSnZLZ05xVEVyWHpFc2hDUEd5M0lTSlZuSEtCemhPbnRiU0daU2swdjljU2RyZFIyMzRHOFY1UE02UzAtTXRzNjJGVFVOUUttVmhKbTlXSFpTNVEzakpvZXpnQXdzanFHSUdhalRISEt2VlVibk1FZHc4OFN1dmdHUDQ?hl=es-419&gl=US&ceid=US%3Aes-419|Los saudíes están furiosos. Los daneses no saben qué hacer. Colombia ha retrocedido. México y Canadá están entre tener y no tener aranceles. China ha tomado represalias, desencadenando una guerra comercial entre las superpotencias económicas. Los británicos, siempre orgullosos de su “relación especial” con Estados Unidos, están recurriendo a su tradición de diplomacia discreta.
Es como si el presidente Donald Trump hubiera lanzado una bolsa de canicas a través del escenario global, bajo los pies de líderes extranjeros que a menudo han avanzado juntos a lo largo de ocho décadas de orden global posguerra.
Todos, parece, están respondiendo a Trump, incluso el líder de Australia, cuando la semana pasada le pidieron su reacción después de que Trump anunciara que Estados Unidos “tomaría control” de la devastada Franja de Gaza y la convertiría en la “Riviera de Oriente Medio”.
“No voy a, como primer ministro de Australia, dar un comentario diario sobre las declaraciones del presidente de Estados Unidos”, declaró Anthony Albanese a los periodistas.
Reconocido públicamente o no, los líderes mundiales están observando el enfoque destructor de Trump hacia algunas instituciones gubernamentales estadounidenses y se preguntan sobre aquellas del orden posguerra fría: ¿Qué pasa con los roles de Estados Unidos en la OTAN, las Naciones Unidas, el Banco Mundial y otros pilares del orden internacional?
|apnews
Mons. Víctor Villegas ante crisis política y económica en Perú: “No caigamos en el pesimismo, trabajemos juntos”|https://news.google.com/read/CBMiygFBVV95cUxPU2NGbU9QNTJ2R1EwM2FTU1ZfVFBZT2VlSHFNU285bjQzRTRCOWxMUGx4RUw2UE11NHAtdWFBVnpvTkFIbTdjQ3RndFFXMTd2WFRVb1E2VXc1ODhqNFQ5a0dOVWRFeHhMTzlpZFNzRThSb1RWSkpuNjFWVWJtNElhRmsyS1BWZU1iUGRiZWxWR1V6MUR4bFFGUnhDVUhyVWNNdWJtRHphRGJvZXNKazltbmMzemN5NkppSXh0eGFFMDRLZ1JMSUo2cHdB?hl=es-419&gl=US&ceid=US%3Aes-419|Los efectos de la minería ilegal, las amenazas constantes contra los líderes ambientales, una economía precaria y la ausencia de compromisos de quienes deciden por la mayoría, son realidades que desafían la actividad Pastoral de la Iglesia peruana. Así lo manifiesta Monseñor Víctor Villegas.
“El pueblo de Dios siente mucho, lo que está sucediendo en la selva, porque la minería legal e ilegal, contamina las fuentes de agua; entonces hay muchos dirigentes que, por defender sus territorios de las transnacionales, se meten en problemas que llegan hasta el martirio. De hecho, ya tenemos 41 personas asesinadas por este motivo, ese un sufrimiento para la Iglesia”.
Luego está la crisis del sector económico que desde la perspectiva del obispo puede mostrar cifras presumiblemente alentadoras respecto a temas como el crecimiento del PIB, pero los datos no son coherentes con la experiencia de la gente en las ciudades y el campo. “Si vas a los lugares más apartados y pobres del país, verás que es una situación complicada porque no hay lo suficiente para cubrir las necesidades básicas”, afirma. 
Promesas rotas
Durante los últimos 8 años, la inestabilidad política en Perú se ha hecho evidente con el paso de 6 presidentes, esto ha terminado por desalentar la inversión privada y bloquear proyectos internacionales que en su momento se pensaron como una oportunidad para el desarrollo de la población.
En septiembre de 2024, la Compañía Peruana de Estudios de Mercadeo y Opinión (CPI) reveló que el 44% de los ciudadanos afronta problemas de salud. Entre los desafíos está la escasez de médicos y medicamentos para tratar ciertas patologías. Así, el 85% de la población peruana desaprueba la gestión pública de la salud, porque sus necesidades están insatisfechas. “El sector salud es uno de los peor tratados en el país. Por más millones que inviertan las autoridades, no se ven los resultados, porque si vas a sacar una cita, te la dan para cuatro meses después. No hay servicios de radiología como las radiografías o tomografías y si tienes una emergencia, no hay camas, ahí es donde se manifiesta la crisis”, agrega el prelado.
Para Monseñor Villegas “el pueblo de Dios sufre porque no siente el compromiso de unos y otros. Vemos que las autoridades no se preocupan por las cuestiones sociales del país, incluso esa indiferencia se siente dentro de la iglesia”, lo que le lleva a hacer una autocrítica. “Habría que preguntarles a algunos sacerdotes… ¿Cuántas veces también nosotros no somos solidarios con los sufrimientos del pueblo de Dios? Te has hecho sacerdote para servir y no para servirte, para que estés con el pueblo de Dios y camines con ese pueblo encomendado. Es la cuestión del clericalismo… a Dios gracias se está trabajando en ello, pero todavía hay raíces metidas que deben superarse, porque ese es otro de los dolores del pueblo peruano”. 
Vencer barreras
En la Conferencia Episcopal Mons. Víctor Villegas es el secretario ejecutivo de la Comisión Episcopal de Acción Social (CEAS) el organismo creado en 1965 en el marco del Concilio Vaticano II. Su misión orientada a la defensa y la promoción de los derechos humanos desde el evangelio y la Doctrina Social de la Iglesia, le dan argumentos para opinar sobre la realidad del país y el camino del episcopado, que durante los últimos años ha vivido un proceso de renovación y reestructuración.
“Hay mucha expectativa, yo al menos estoy muy contento en ese aspecto. Veo una Conferencia Episcopal en la que se puede hablar, se pueden poner los temas en conjunto, es un ambiente de fraternidad y cercanía… Eso mismo buscamos transmitirlo al nivel del clero. Vivir esa horizontalidad que nos pide Francisco, con el pueblo de Dios, la jerarquía y entre nosotros mismos. Creo que vamos dando pasos, vamos caminando”. Pese a los dolores de la realidad y la Iglesia peruana, el prelado invita a sostener la esperanza. “No caigamos en el pesimismo” advierte.
“Hay un renacer a nivel de la conferencia episcopal, del clero y los seminaristas. Ciertamente vemos el lado negativo, pero también el positivo. Vemos el auge de gente comprometida y motivada a salir adelante. En las zonas deprimidas, se organizan con creatividad al lado de sus pastores y párrocos, lideran iniciativas como los comedores populares y las familias se agrupan para compartir. Vemos un trabajo de la Comisión Episcopal, comprometido con la cuestión de la defensa del medio ambiente y jóvenes dispuestos a cuidar la naturaleza.
Un solo corazón
Tenemos que caminar con la mirada puesta delante porque hay líderes que están surgiendo y las áreas se están articulando”. Villegas confía en el futuro pese a los dolores, esperanza que se fortalece con el carisma agustiniano por el que optó y en el que vive. “Debemos vencer esas barreras que el mundo nos pone. Trabajemos juntos. Para las cosas de Dios hay que ser sinvergüenzas y tercos, por ahí va el asunto.  Mientras la sociedad te dice, cada uno baila con su pañuelo, eres tú y tu empresa, ocúpate de lo tuyo, no te cargues con otros problemas, nosotros decimos, tenemos la obligación de ayudarnos para salir adelante”.
En sus palabras ese es el aporte a la sinodalidad que puede hacer como hijo de San Agustín. “Debemos ser una sola alma y un solo corazón siempre dirigidos hacia Dios. Entonces, caminemos juntos, vamos a darnos la mano, vamos a dar nuestras ideas para salir adelante. Quizás el mundo nos pone barreras para trabajar, escrúpulos y miedo al qué dirán, pero debemos ser el punto negro en la mesa blanca. Quizás se van a reír de nosotros, pero esa es nuestra tarea como cristianos. Así vamos a lograr las cosas. Y ese es nuestro aporte a la sociedad”.
Reflexiones que el obispo del Vicariato de Chota compartió durante el Encuentro Regional de los países bolivarianos organizado por el Celam y que considera es un signo de esperanza. “Somos delegaciones de diferentes países que dialogan, entusiasmados en que estos pensamientos no se queden solamente en el papel, sino que podamos logar cosas en común para aportar al cambio que nos pide el Papa”.


|ADN Celam
CONTINÚA LA MANIPULACIÓN POLÍTICA DEL SENADO|https://news.google.com/read/CBMif0FVX3lxTFBNTTE1WHZ1Sy0yLTkzQUUyN3Z1VGxhMl9WblJ5OFU5bUhUYkcyWU83OFVYbVNfemdnZVMySFdabW9JS2JDYlI2UXBCQ05Oa3VybFFBM0Zfdjg1LU9HNEtsOXdXVC00WG5EVDJraVY2b3ZEUzB0R094aXFFWmdGRWs?hl=es-419&gl=US&ceid=US%3Aes-419|En un reciente artículo en este Digital (“La utilización espuria del Senado”, Sistema Digital, 13 de febrero de 2025) señalamos que el Partido Popular está utilizando el Senado con fines inconstitucionales, desbordando las funciones que corresponden a esta segunda Cámara. Cuando no gobierna, la derecha española acostumbra a manipular (hasta desfigurarlos) los órganos del Estado en su propio beneficio sin respeto al ordenamiento y, por ello, modificó el Reglamento del Senado amparándose en una interpretación propia de leguleyos de colmillo retorcido para retrasar unas pocas semanas (un mes y diez días) la aprobación de la proposición de ley de amnistía. Sólo el odio y la rabia explican una operación tan fútil que, en el mejor de los casos, retrasaría unos pocos días (sin impedirla) la aprobación de la proposición de ley, pero parece que el Partido Popular sólo entiende el papel de las moscas que en verano molestan al ganado, sin mayores resultados prácticos.
Ya tenemos la primera respuesta a ese intento manipulador, pues el Tribunal Constitucional ha declarado inconstitucional la reforma de ese artículo 133 del Reglamento de Senado que atribuía a la Mesa de éste la decisión sobre la tramitación urgente de proposiciones de ley cuando así lo pide el Gobierno o el Congreso de los Diputados. El artículo 90.3 de la Constitución sólo habla de “proyectos” y, al amparo de esa expresión, algún brillante leguleyo del Senado tuvo la idea de atribuir a la Mesa de la Cámara la decisión sobre la tramitación urgente de las “proposiciones” de ley (no de los proyectos) hurtándosela al Gobierno y al Congreso. No se ha publicado aún la sentencia, pero se conoce ya por el comunicado informativo del Tribunal Constitucional.
Pero el Partido Popular no descansa en la utilización del Senado. Según informan ABC (9, 10 y 12 de marzo) y El País (11 de marzo) el Senado está preparando una nueva reforma del Reglamento del Senado para seguir en el divertido juego de la guerra de guerrillas contra el Gobierno y contra el Congreso. Según los diarios que citamos, la reforma de Reglamento del Senado iría en dos direcciones complementarias.
En primer lugar, se pretende que el Senado pueda suscitar un conflicto de atribuciones frente al Congreso cuando éste se demore al tramitar una proposición de ley adoptada por el Senado. Éste es un brindis al sol porque actualmente nada impide al Senado suscitar conflictos de atribuciones en el Tribunal Constitucional, como lo prueban los muy forzados conflictos que ya ha suscitado con escasa base jurídica, pero con mucha vocación de hacer ruido. En todo caso, en términos jurídicos, el planteamiento es equívoco porque en el Derecho constitucional las obligaciones de hacer están muy tasadas; es decir, el círculo de autonomía de cada Cámara impide que incluso mediante una sentencia constitucional el Congreso tramite una proposición de ley adoptada por el Senado si sus órganos (Mesa o Pleno) no lo acuerdan voluntariamente. Es una iniciativa inviable en la práctica que sólo pretende hacer ruido.
En segundo lugar, la otra reforma del Reglamento del Senado consiste, según la prensa, en obligar al Presidente del Gobierno a acudir a sesiones mensuales de control en esta Cámara. La iniciativa parece olvidar que los Reglamentos parlamentarios tienen rango de ley, pero no fuerza de ley, son normas que obligan ad intra de la Cámara, pero no ad extra, por lo que no obligan jurídicamente al Gobierno y no le obligan más allá de lo que políticamente le obliga en la actualidad. La reforma olvida que las relaciones entre el Parlamento y el Gobierno son políticamente muy potentes (sobre todo, en el caso del Congreso que otorga o deniega la confianza al Gobierno), pero poseen muy escasa densidad jurídica, por lo que ninguna de las dos Cámaras tiene instrumentos con fuerza de obligar al Gobierno a realizar una determinada acción. Por eso, de reformarse el Reglamento del Senado en el sentido que anuncia la prensa, sería un segundo brindis al sol sin efectos prácticos. Incluso sería inconstitucional porque la Constitución establece la plena autonomía de los órganos constitucionales que no pueden estar sometidos al mandato de otros órganos constitucionales más allá de los que prevé la propia Constitución.
En definitiva, el Partido Popular podrá maquinar cuántos artificios jurídicos se le ocurran con el fin de instalar al Senado en la guerra de guerrillas contra el Gobierno y contra el Congreso, pero esa guerra deteriora a la democracia, no al Gobierno, no al Congreso, no al PSOE.
|Sistema Digital
Actualización de la Política Pública de Primera Infancia en Cali: un legado social que se construye en la administración del alcalde Eder|https://news.google.com/read/CBMijwJBVV95cUxOMFBBeDVlVVc0ZnQ2WHJiQk5qcTlDdjZ0TWVIbnM2d0gxWERWYmhBMklXQVlRVHVHV292REhYZGJJSFNrWVlNZnlDSGNOaEVCTXdzMGxkbXNmZERmUmc2MUQ3ejQ0N1lsSVlqLWVnU21xYVJfcS1CNWxfeXFMNlZ3bjE2X3ZtMUJOWG5aUkc2VEtUbDdjX08wUU5HSmwxaTJ4aU9KaWtHMW5UbkVFOTZrWGdRdC1xT3p3RnJkQzVUMGZFNlp3SmhXNHNnbVVTMzVaTGRLMHNhY3U2OWhVZk1NNWlsWUE2Z0R4TUgtQncxcTROTHM3a1RqWDkzMHJidzFmdHJidEFDZHlXMTRsZlRJ?hl=es-419&gl=US&ceid=US%3Aes-419|En un compromiso por fortalecer las políticas públicas que garantizan los derechos de la niñez, la Alcaldía de Cali desde la Secretaría de Bienestar Social, la Subsecretaría de la primera infancia, en articulación con la Subsecretaría de poblaciones y etnias y el Observatorio de políticas públicas, se está priorizando para la vigencia 2025 el proyecto de Evaluación y actualización de la Política pública de primera infancia, infancia y adolescencia de Santiago de Cali.
“Desde nuestra alcaldía trabajamos duro para proteger a niñas, niños y adolescentes en Santiago de Cali, fortaleciendo la atención de la primera infancia, la calidad y la cobertura educativa, generando entornos protectores”, destaca el alcalde Alejandro Eder y enfatiza sobre el compromiso que tiene su administración con la protección de la primera infancia.
 
Evaluación y actualización de la Política Pública de Primera Infancia
Para ello se realizó una articulación con el Observatorio de Políticas Públicas de Bienestar Social para coordinar conjuntamente el seguimiento de la implementación de la política pública, por parte de los 8 organismos implementadores, entre ellos: la Secretaría de Seguridad y Justicia, la Secretaría de Paz y Cultura Ciudadana, Secretaría de Salud, Secretaría de Cultura, entre otros.
Gracias a un trabajo articulado que une esfuerzos para lograr una atención integral a la primera infancia, y que además de fortalecer las bases del desarrollo infantil, es de vital importancia para el desarrollo de Cali. 
Considerando que estas Políticas tienen implicaciones directas en el desarrollo, la igualdad de oportunidades, la seguridad, la reducción de brechas sociales y la construcción de una ciudad más equitativa. Logrando además, un enfoque basado en la medición de impacto y en la articulación entre diferentes organismos.
En un modelo innovador que impulsa la administración de Alejandro Eder, ratificando su compromiso con la protección tanto de las mujeres gestantes, como de los niños y niñas hasta los 5 años de edad.
De esta manera Cali está demostrando que consolidar las iniciativas de protección a la primera infancia, es también consolidar el camino de reconciliación que ha marcado el alcalde Alejandro Eder para lograr el desarrollo de Cali. Para conocer todos los detalles respecto a la Política Pública de Primera Infancia, Infancia y Adolescencia de Santiago de Cali, consulte más información con la Subsecretaría de la Primera Infancia dando clic aquí.
|Alcaldia de Santiago de Cadi
Hacia una vejez digna: Armenia fortalece su política para adultos mayores|https://news.google.com/read/CBMigAFBVV95cUxOa043SnpXcWFUY19zSVZpUU5heGZKWG5XeVlEV0o0UnlCQ1ZJalpPYzROMUVWOFBDMkJYUk5TdzUzbEJVS1VkajA5UHZNSnNabUwzVUZzc09WdlVKOWhRZVZYV2tzS05LaEpidWNZV25EblJ1MHpneXBDRGQtZ0NHTQ?hl=es-419&gl=US&ceid=US%3Aes-419|La Administración Municipal de Armenia, en articulación con la Universidad del Quindío y la Secretaría de Desarrollo Social, ha dado un paso importante en la consolidación de estrategias para la protección de los adultos mayores de la ciudad. A través de un trabajo conjunto con los centros de protección, se ha planteado la necesidad de estructurar un proyecto que permita gestionar recursos nacionales y fortalecer la garantía de derechos de esta población vulnerable.
En este contexto, la iniciativa se fundamenta en el cumplimiento del Acuerdo No. 143 del 25 de julio de 2019, dentro del eje de Formación de Recurso Humano e Investigación. Se prioriza la capacitación y certificación de los trabajadores que atienden a esta población, así como la modernización de los instrumentos de seguimiento y monitoreo en los centros de protección y centros día.
“Esta unión interinstitucional con la universidad y los centros de protección responde a la necesidad de velar por una atención de mayor calidad para nuestros adultos mayores que no tienen recursos ni familia en la ciudad. Además de subsanar la problemática departamental tan grande que existe con el pago de la estampilla pro adulto mayor y que tiene a los centros de protección preocupados”, aclaró Jenny Gómez Betancourt, secretaria de Desarrollo Social. 
Los representantes de los centros de protección expresaron su compromiso con este proceso, destacando la importancia de establecer mesas de trabajo mensuales con la Administración Municipal y la Universidad del Quindío. Estas reuniones permitirán realizar un diagnóstico detallado sobre la situación de los adultos mayores en Armenia y estructurar una propuesta a nivel nacional que pueda ser presentada al Gobierno para su implementación.
¿Cuáles son las bases de la política pública para los adultos mayores en Armenia?
Con la expedición del Acuerdo No. 143 del 25 de julio de 2019, la Alcaldía de Armenia adoptó la política pública centrada en los adultos mayores, bajo enfoques de género y diferenciales. Sus principales objetivos son:
Promover el ejercicio de los derechos y deberes de las personas envejecientes en el municipio de Armenia, a través de acciones tendientes a la participación ciudadana en diferentes instancias locales y municipales.
Garantizar protección social integral a la población vulnerable de adultos mayores del Municipio, a través del trabajo mancomunado de los diferentes actores para garantizar una mejor calidad de vida de la población.
Fomentar una cultura frente al envejecimiento activo durante el curso de vida en los habitantes del municipio de Armenia, contando para ello con una labor interistitucional que propenda una imagen positiva.
Fortalecer la formación del talento humano e investigativo en temas relacionados con envejecimiento y vejez del municipio de Armenia, contando con las competencias requeridas y un desempeño ético que propenda por el bienestar de dicho grupo poblacional.
|Consultor Salud
EURUSD, GBPUSD, USDJPY: Cómo la política y los tipos de interés marcan el ritmo del mercado Forex|https://news.google.com/read/CBMivgFBVV95cUxQNHRvQkZ2dGQ2WUFEeXdDWWs2bEVqMVJadmxIYTd5MTJUemFDQXlLeFJtdXFkSGlBenozdERpLXluem9RZWhwVlZFbkNPbjhvckFySVBoWUktVFVtLW1xb2RudVZnWmJfZm1vQzNkakZIc1k3ZjlxNlZfYUkzaVVGbkdyT3U5dGNhNjFjMUNweURFai1OeHZmWHU3SnVLVmRRYWpkam5HblN6RFlWRUo1eUJuR2tuX25RUWtNNGV3?hl=es-419&gl=US&ceid=US%3Aes-419|El mercado de divisas registra movimientos destacados esta semana en sus principales pares: EURUSD, GBPUSD y JPYUSD. Estas fluctuaciones responden a decisiones políticas recientes, expectativas sobre tipos de interés y un contexto económico global marcado por conflictos comerciales y tensiones geopolíticas.
EURUSD
El EURUSD permanece estable cerca de 1,09 dólares por euro, próximo a sus niveles más altos desde noviembre pasado. Esta estabilidad está impulsada por la reciente aprobación del Parlamento alemán de un significativo incremento en el endeudamiento público. Esta medida, promovida por los conservadores de la CDU/CSU junto al SPD y Los Verdes, implica excluir el gasto en defensa de las limitaciones tradicionales sobre la deuda pública, además de establecer un ambicioso plan de inversiones en infraestructura por valor de 500.000 millones de euros. Ahora, la decisión depende del voto del Bundesrat previsto para este viernes. Simultáneamente, los inversores están atentos a los avances del conflicto en Ucrania y las tensiones comerciales internacionales. Sobre política monetaria, las expectativas de recortes de tasas por parte del Banco Central Europeo (BCE) se reducen, anticipando solo dos disminuciones este año, posiblemente en abril y junio, manteniéndose las tasas por encima del 2%.
