titulo|link|contenido|fuente
"Karina Banfi: El oficialismo tiene ""falta de profesionalidad en la cuestión política, buscan outsider y no están preparados"""|https://news.google.com/read/CBMi7gFBVV95cUxQcWU5OWxLN3dTa2FiYWpCU2paLVZ3YTU5MDFWbkhWTGszWVJPdnQ5WDJZVU1aaW1tR0pQUEJkNmdBbWdqQk1kRjRXQ1R3aXcxWmJta3luNjdHeHdvRmhiRjVfZ1ZRSFhtVVp5RWVFc0NZUTlucnZueXBCTGhfRG05RnlKYzBmdlpQN1loVHN5SUU5T09aSmlzSHhjOFc1MFZ2QjBhcHJDUUU0LVpwSGhRMk91ckVQd1lKSDM1OGRSSDZVQWY4UmI5ZXN6TWVDb0RIZ2F6YVN1WEstaHFVT0dRSm5UVjlRTHZZTmM1ZVNR0gFKQVVfeXFMTUhVSUlRMHllMWRxNWJCVUhsbzViQjg1YTZSeWVJRzF2alFoXzBiNGRGem51SFdvenNoR2R3blpRZDItNUtPS3paTlE?hl=es-419&gl=US&ceid=US%3Aes-419|Karina Banfi, diputada nacional de la Unión Cívica Radical por la provincia de Buenos Aires, se refirió a la situación de Bahía Blanca, de donde es oriunda, y a lo ocurrido en el Congreso con la marcha de los jubilados y las peleas del oficialismo.  En CNN Primera Mañana, afirmó que “la imagen es desoladora, paso el agua por una lluvia intensa pero las consecuencias son que hubo un terremoto, hay puentes caídos, caminos rotos, no hay luz en el centro de la ciudad, siguen sacando autos de los subsuelos. La pérdida es irreparable, afectó a toda la ciudad y a las cercanas”.  Aseguró que “la ayuda parece insuficiente” pero agradeció “a todos los argentinos que se han puesto esto al hombro, que han brindado elementos, algún tipo de oración, y a los voluntarios porque las manos no sobran”.  Consultada sobre la represión durante la marcha de apoyo a los jubilados, la legisladora radical destacó que “la gente tiene razón cuando dice que los políticos están fuera de eje. Lo que paso en el Congreso fue bochorno, es la disputa de los extremos que va a terminar así, no puede terminar de otra forma”.  Consideró que “el peronismo cuando no es gobierno saca su costado fascista, busca la desestabilización y, por el otro lado, hay un gobierno novato, poco profesional” y remarcó que “las fuerzas armadas y de seguridad pueden asumir un trabajo ejemplar, como en Bahía Blanca, pero no tienen fuerzas elite”.  Sobre lo sucedido adentro del Congreso, en la Cámara de Diputados, afirmó que el oficialismo “no tiene costumbre de la discusión retórica, es falta de profesionalidad en la cuestión política, buscan outsider y no están preparados con el trabajo profesional de la política. El remedio es peor que la enfermedad”.  En este sentido, Karina Banfi afirmó que “la justicia no tiene que hacer el trabajo que hacer y no es confiable. Las comisiones investigadores no han servido para nada, terminan siendo un circo político.En el Congreso tiene que haber un proceso que vaya acompañando al judicial”.  Remarcó que “no hay que mirar al Congreso para que investigue al presidente que está investigado por un supuesto hecho de corrupción, hay que mirar a la justicia. No deben acobardarse en un silla, ellos no responden, ni responde el poder ejecutivo, y miran al Congreso, que el viernes se estaban fajando porque no se ponían de acuerdo”.  La diputada radical, además, aseguró que “el jefe de Gabinete de la Nación se pega el faltazo en el Congreso, desde septiembre del año pasado no ha vuelto, él tiene que dar la explicaciones institucionales”.`|CNN Radio Argentina 
La republicana Tudor Dixon contempla volver a postularse como candidata a gobernadora de Michigan|https://news.google.com/read/CBMiywFBVV95cUxOM0liSkg3NURERUczbDR2b0YxTVpVLWlLcXlqaDUwUFJEYlVVVjd5OUtjNkxBc3hZalNkVndKazlUNmJKQlFNOFNrTmhEZ0hhZVlMOUYyVWlYd3dud1RqX0NSY1B0X1A5T0ZXRW9iOTFqcFVmU1hzN243OGlIUXhXMkNwUWlyallwX3h6V1o3RnhjVmk1UWF2Q0s2S0ZoZ0MtMmNOSmZfaklrVlZpQm16ZEdXMlAxbzY5YWZldHUzaERkZzNLb3lUWUpLaw?hl=es-419&gl=US&ceid=US%3Aes-419|res años después de su fallida campaña como candidata republicana al gobierno de Michigan, Tudor Dixon estudia la opción de volver a contender en la política a sabiendas de que, presuntamente, cuenta con el respaldo del presidente Donald Trump.  La aguerrida mujer que hace una década venció al cáncer de mama, contendió en las elecciones estatales de 2022, pero fue superada por la demócrata Gretchen Whitmer.  Ahora, con mayor experiencia, la empresaria de 47 años debe elegir, entre sumarse a la carrera para tratar de gobernar a su estado natal o bien por un escaño en el Senado.  Mediante una publicación en la plataforma social X, anteriormente conocida como Twitter, se refirió al par de opciones que se le presentan.  “Quiero hacer el mayor bien posible por nuestro querido estado. Ambas contiendas presentan oportunidades únicas y diferentes maneras de beneficiar a Michigan.  Pronto decidiré dónde mi experiencia y mis talentos beneficiarán más al estado que tanto amamos”, indicó.   Hace 10 años, Tudor Dixon venció al cáncer de mama. (Crédito: Paul Sancya / AP) Leal al mandatario de la nación, Tudor Dixon también elogió la controversial transformación impulsada por el republicano al intentar erradicar el problema migratorio presente en varias ciudades estadounidenses y al reducir el gasto del gobierno para con ello mejorar la economía.  “El presidente Trump está liderando el camino a nivel nacional. Está cumpliendo sus promesas de asegurar la frontera, traer empleos manufactureros a casa e impulsar la independencia energética.  Me comprometo a apoyar al presidente Trump aquí en Michigan para cumplir con la agenda de Estados Unidos Primero”, subrayó.  Dixon es consciente de que, a diferencia de hace tres años, el Partido Republicano logró fortalecerse en el “Estado de los Grandes Lagos” y gracias a ello Donald Trump le sacó 80,000 votos de ventaja a Kamala Harris.  Así que existen grandes probabilidades de que pueda reemplazar al demócrata Gary Peters en el Senado o bien a Gretchen Whitmer, quien debido a los límites de mandato del estado no puede buscar la reelección y quizá opte por tomarse un tiempo de descanso para posiblemente volver a la política en busca de candidatura presidencial demócrata en 2028, pues algunos analistas la vislumbran como una carta fuerte para enfrentar a los conservadores.|La Opinion
Qué es el Tren de Aragua, centro de la política migratoria de Trump|https://news.google.com/read/CBMimAFBVV95cUxNMEg5aHBFTG8yQ0hyWDVBRU5Ic0wtTDZqR281QU5zQWd2VG1PRDNiMldUbVpKZ0xlY183Yk5iMzRqQllLSVhWTURzWXQwWDhVaFRaZ2V1MnZiaV9CVXJ4Y3VKOTd1TUt6ZXNVREJDVHdBM1lFZlA4REFqdW9ncXVNZmh5SWtkTnJiZG10SU85dHVXS1ZnQ3FxWdIBoAFBVV95cUxOb2JMRi1KWXVDTFB0aElXbDJDa1FmV3FZZkphc1NXRGNYWHkyZzE5cmxXN3U2UDFVNmN5cXYzRkdPZnlYa285akIxS0VETjRFdGd4RkJiU3NBU1FuQjdSaFhBLTV1NXdoWUNwUmc5cklDdXVLN1BsNlVUNXlReENVLTJ4TmxRcjVCYmtWc09mbzBXRHc3T0xoenhhaVFNams1?hl=es-419&gl=US&ceid=US%3Aes-419|"En el centro de una batalla política y legal cada vez más tensa, liderada por el presidente Donald Trump, se encuentra la pandilla venezolana Tren de Aragua. Para algunos, una amenaza organizada y violenta que amenaza la seguridad nacional de Estados Unidos, y para otros, el pretexto del gobierno para su discurso antimigrante y sus deportaciones masivas.  Este fin de semana, Trump afirmó que la pandilla estaba invadiendo Estados Unidos e invocó la Ley de Enemigos Extranjeros, una ley de 1738 poco utilizada que permite al presidente deportar a extranjeros en tiempos de guerra. El gobierno envió a cientos de inmigrantes a una prisión en El Salvador, incluso cuando un juez federal prohibió temporalmente las deportaciones. Los vuelos ya estaban en vuelo cuando se emitió el fallo. En una audiencia del caso en un tribunal federal el lunes, el juez federal de distrito James Boasberg resumió la postura del gobierno sobre su orden judicial del sábado como: ""No nos importa, haremos lo que queramos"".  Trump y sus partidarios han intentado retratar a la pandilla como la personificación del inmigrante criminal que tan a menudo evocan para explicar la cada vez más agresiva aplicación de las leyes migratorias del presidente, que también ha incluido el envío de cientos de migrantes venezolanos a la base naval estadounidense en la Bahía de Guantánamo, Cuba, y la privación de la residencia legal temporal en Estados Unidos a cientos de miles más.  La realidad es más compleja.  Orígenes en prisión Tren de Aragua surgió en la década del 2000 en una conocida penitenciaría del centro-norte de Venezuela, donde los líderes de la pandilla llegaron a tener su propio zoológico, club nocturno y banco dentro de la prisión. Lo que distingue a la pandilla de otras organizaciones criminales más grandes es la rapidez y facilidad con la que se ha extendido por gran parte del continente americano, un movimiento que, según los expertos, está vinculado al éxodo masivo de venezolanos.  Según la ONU, aproximadamente 7.7 millones de venezolanos han abandonado su país en la última década, más de una cuarta parte de la población y, casi con certeza, un recuento insuficiente. Se trata del mayor desplazamiento masivo en la historia de América y uno de los mayores de la era moderna en cualquier parte del mundo, superando, según algunas estimaciones, incluso la crisis de refugiados sirios. Aproximadamente tres cuartos de millón de personas han llegado a Estados Unidos desde Venezuela desde 2022.  El flujo masivo y prolongado desde Venezuela hacia la región circundante proporcionó a la pandilla una vía fácil para crecer. Su negocio insignia es un modelo de tráfico sexual que utiliza la migración como arma coercitiva.  La pandilla facilita el viaje de una mujer fuera de Venezuela y, cuando llega a su destino, la obliga a prostituirse para saldar una deuda, a menudo insalvable. El Tren de Aragua desarrolló este modelo en Colombia a partir de 2018 y ahora lo practica en varios países, incluyendo, según fiscales federales, Estados Unidos.  En Estados Unidos, las fuerzas del orden han acusado a decenas de personas de pertenecer al Tren de Aragua en al menos 14 estados, según un análisis de NBC News. Los delitos incluyen tráfico sexual en Nashville, Tennessee; Robo de cajeros automáticos en Nueva York; un sicariato en Miami; y tráfico de armas de baja envergadura en Denver. Seis estados, Colorado, Florida, Illinois, Nueva York, Texas y Virginia, tienen lo que la policía ha identificado como la presencia más organizada, con empresas que reflejan sus operaciones en Latinoamérica.  Pero Tren de Aragua se ve eclipsado tanto en tamaño como en organización por organizaciones criminales más consolidadas, tanto extranjeras como nacionales. A menudo no está claro cómo las fuerzas del orden identifican a los pandilleros, y la evidencia de su participación es tenue en algunos de los casos más violentos y de alto perfil que Trump y sus partidarios atribuyen a la pandilla. Esto ha llevado a los defensores a sugerir que el espectro de la violencia se está utilizando como pretexto para violar los derechos civiles.  En medio de esta situación se encuentran los venezolanos respetuosos de la ley. Según las fuerzas del orden, son los blancos más frecuentes de la violencia pandillera. También están en la mira de la ofensiva migratoria de Trump."|Telemundo 51
De Guindos dice que la política comercial de Trump hace más opaca la situación para el BCE|https://news.google.com/read/CBMiogFBVV95cUxQRjREQnBJREpUb0pHUVVPQ3Y3RlMtMHExMVdNR1l4OWtlUElIUnVWV01xZXA5R05XdVIzR1YtV2FCMGxWUVBQNHJER2RvZVdCTnR1dFRwTUw5Nm5NRzZ2S0ZUUnBlc0NNbnFfSWFYbGNoMjhqalVxNXN1V1g3bDRqeWlscjYzLWVhd2dZMmdRUG1WdmdVQ2hBMEVaZVQ2Yzc0QVE?hl=es-419&gl=US&ceid=US%3Aes-419|MADRID, 17 mar (Reuters) -La política arancelaria del presidente de Estados Unidos, Donald Trump, ha hecho más difíciles las decisiones de política monetaria del Banco Central Europeo, dijo el lunes el vicepresidente del Banco Central Europeo, Luis de Guindos.
El aumento de la incertidumbre provocado por los aranceles de Trump ha reducido ""la claridad desde el punto de vista de lo que son las decisiones a futuro"", dijo De Guindos en una entrevista con la emisora de radio española Onda Cero. ""Te mueves en una situación de mucha más oscuridad que la que nos movíamos hace simplemente unos seis meses"".
La inflación alcanzará probablemente el objetivo del 2% del BCE en el primer trimestre de 2026, más tarde de la fecha prevista anteriormente de mediados de 2025, debido al aumento de los precios de la energía, dijo De Guindos.
No obstante, De Guindos insistió en que ""todo va en la dirección correcta"".
Cualquier efecto directo de los aranceles sobre los precios al consumo podría verse compensado a más largo plazo por la ralentización de la actividad económica, dijo.
(Información de Inti Landauro y David Latona; edición de Charlie Devereux; edición en español de Jorge Ollero Castela)
|Reuters
Demócratas que se postulan para gobernador de NJ navegan por la política de inmigración|https://news.google.com/read/CBMiqgFBVV95cUxPZkl3Rm5WdTlObGM3QVNfNXdUaDhHZE82TEdzcmEtbGZjMUlNZ2tvY283bGxOeTh1T3NFMkh6ckN6UXVsQm1iZFVRZ3IyS3Etdm0xeWRaUVJJZkJsUnRlVExRRnZOcGJVRWRzajRwYXhZVU51UWJBd29GVWdFTExWZEluVVFoMG1neVZOZXdQb1Z5VElUc2RtSTdBeXprVXpueWxWRGYyTWRNZ9IBsgFBVV95cUxOZDFndnpiQjVZNXR2VXlSMzNVZFVqdVZhTGU5emlmejUyMzN6dHdQR0M2TVF6MGVsRExyckw4eTZOZXQwWU4yaE1DV25TaWd6MnhFQVVJaHpGUUhQNWFWQ1phcDdlWnpWYmdaeVJDMWNwYzYweldSY2pGaDJKVjBwUUhsWDd4dTN4UkUzZVpFS183YkJQcm1kMlNpbVdFT0ZTXy1uU3BodWNDQ0o2aVBHQWt3?hl=es-419&gl=US&ceid=US%3Aes-419|"NUEVA JERSEY -- En un tramo industrial de la carretera de la ciudad más grande de Nueva Jersey, el alcalde de Newark, Ras Baraka, se presentó la semana pasada con activistas por los derechos de los inmigrantes para protestar contra el acuerdo del gobierno de Trump con una empresa privada para abrir el primer centro de detención migratoria del segundo mandato del presidente.  Los votantes, afirmó, ""no creen que se deba detener a las personas simplemente por intentar obtener la ciudadanía estadounidense"".  Al oponerse a la construcción del centro de detención de 1000 camas, Baraka, uno de los seis demócratas que se postulan a gobernador en Nueva Jersey este año, ha adoptado un enfoque agresivo en un tema con el que su partido ha tenido dificultades recientemente. Otros candidatos se han acercado al presidente Donald Trump, adoptando en parte su enfoque de mano dura hacia la inmigración, o han dedicado la mayor parte del tiempo a hablar de la economía y el alto costo de la vida.  Esta diversidad de posturas convierte las primarias de junio de este año para gobernador de Nueva Jersey en una especie de campo de pruebas para los demócratas, que luchan por encontrar su equilibrio en un tema que los ha atormentado durante mucho tiempo. Si la política de mano dura gana en Nueva Jersey, con inclinaciones liberales, los demócratas que se postulan en otras ciudades podrían tener que replantearse la mejor manera de atraer a sus partidarios más leales.  La disputa sobre el centro de detención representa la segunda vez desde la investidura de Trump este año que Newark aparece en los titulares sobre inmigración (la primera se produjo tras los arrestos de ICE en enero), con el alcalde acaparando la atención y trabajando para trazar su propio camino a seguir.  Baraka rechaza la idea de que la mayoría de los votantes apoyen la represión contra los inmigrantes indocumentados. Hace un llamado abierto a defender los derechos constitucionales contra registros e incautaciones sin el debido proceso y una vía viable para obtener la ciudadanía."|Telemundo 47
"Alcalde de Denver califica el arresto de Jeanette Vizguerra como una ""persecución política al estilo de Putin"""|https://news.google.com/read/CBMi2gFBVV95cUxNXzRaV1pBQUhFWFRPSXRGQ3J2cW5YUEJuSUlBd2stZmQ3Ui1UNkJJUGh3d3ZqNWlleFEwTmhsaG1LWUNMbUs2cmpRcjZRSlZkVTd0YWpyVHlFb2dBN205RmJSR1hOQVZKUHF3S2hCNTBEaVVsa3hhbkwwblF0aE9nYWo1RFlqNVdUeXpwTjhDM3NhMVhXRXU2bTBoVm9UWVZNeGFhbW1MY0xNLTd2OGJoOG0tRXcwTW9tZTgzNTRyRGVQZWI2dHBsMlRwekdhZEtUMGdyZW5KQ3lTUQ?hl=es-419&gl=US&ceid=US%3Aes-419|l alcalde de Denver, Mike Johnston, ya había adelantado su compromiso de resistir lo que considera un deseo de Donald Trump de abusar del poder de la presidencia al iniciar una redada nacional y una deportación masiva de inmigrantes indocumentados.  Sin embargo, el arrestó a Jeanette Vizguerra por parte de ICE desató su ira y calificó la detención de Vizguerra como un “claro abuso de poder” y dijo que estaba claro que la insistencia del presidente en que los agentes estaban apuntando a criminales peligrosos es “la gran mentira” de su presidencia.  Incluso, el demócrata fue más allá y criticó a la administración Trump por llevar a cabo lo que él llamó una “persecución política al estilo soviético de disidentes políticos” al arrestar a un destacado defensor de la inmigración de Colorado.  Lo anterior luego de que el Servicio de Inmigración y Control de Aduanas (ICE) arrestó a Jeanette Vizguerra afuera de su trabajo en un Target en Aurora el lunes. Vizguerra, madre de cuatro hijos y abuela, cobró notoriedad en 2017 cuando se refugió en iglesias durante la administración Trump, cuando los lugares de culto estaban vedados para los arrestos de los agentes de inmigración.   Ante la polémica detención, Johnston comparó el arresto de Vizguerra con las persecuciones políticas soviéticas “con el pretexto de la aplicación de la ley migratoria”. Hizo comentarios similares en redes sociales, calificándolo de persecución política “al estilo de Putin”.  “Esta es una madre de ciudadanos estadounidenses que trabaja en Target y ha fundado una organización comunitaria sin fines de lucro. En mi opinión, esto no contribuye a la seguridad de nuestra comunidad. Creo que la hace más anárquica”, dijo Johnston.  Vizguerra ha sido activista contra la detención y la deportación durante años, tras refugiarse en iglesias en 2017. Sus actividades incluyen protestas frente al centro de detención de Aurora. Fue nombrada una de las personas más influyentes de la revista Time en 2017 por su defensa de la inmigración en un artículo escrito por la actriz América Ferrera.  “Derramó sangre, sudor y lágrimas para convertirse en dueña de un negocio, esforzándose por darles a sus hijos más oportunidades que las que ella tuvo. Esto no es un delito. Este es el sueño americano”, escribió Ferrera.  “Está claro que está siendo atacada por su labor de organización comunitaria y sus críticas al sistema de deportación, así como por su abierta defensa de los derechos humanos”, afirmó Johnston.  Vizguerra fue condenada en 2009 por usar documentos falsos. Un juez emitió una orden de deportación en su contra en 2011, pero le permitió quedarse siempre que se presentara periódicamente ante el ICE. Preocupada por lo que pudiera suceder bajo la primera administración de Trump, se refugió en las iglesias de Denver.  Su arresto sigue al de Mahmoud Khalil, estudiante de la Universidad de Columbia y residente legal, quien participó en protestas pro-palestinas el verano pasado. Khalil ha declarado en documentos judiciales que fue perseguido debido a su discurso protegido por la Constitución. |La Opinion
‘Tan decepcionados’: Compradores critican la política de liquidación de Joann Fabrics|https://news.google.com/read/CBMi1gFBVV95cUxOaGRxSjd6VHlOTE82bzVqaF95eFMxdVBONXFOTVItT1J0WmllSFVROUhHbmVEWEhNV3phM285V09sRTJVTVRVY1BoUlBHMnM3MG9lRy1CdWx6ZXZIemxGQUV1ZkxRaW50TklrdXgzejBQMjVaUHFsMFBWdzViR0J3QVM1VXlBSGFxQ0dNWUF5SUxHS080V21KNHZMOHpvd2NoQWhPYTdTZFVjcm5EQzhham8wcDBleHpPQ0JOY2Y2Y1hjN1NhRTRnaExfNGRmb0xQcy1wNzln0gHeAUFVX3lxTE5KWWdHa1hfRlhwQkZvV3RhaEdhczZPYVlfSFVhcTZ2emlUMV9aQmtxN3VaalpIY09qaGNaRVlWN2VhVG1rTjNBczRHNjRTaUk5Y0RXcGY0Y2FNRVdReW5JWkxRSUZHMTQ1eEN1ak1Qc0g5cnRfWVNDYl80dXprV1NUNUhtQmhkeFdfRnlwdjdoemVsdnRyeTFZb2JTY2I4M1ZBRm1fYjdWaG4tVHRkU25yOG82TkF5Sl9SUXNlOVkyZjJYbjhkd2xya0t1bEoxUWxZcEhwZmJnTXJaYTJCZw?hl=es-419&gl=US&ceid=US%3Aes-419|"A medida que Joann Fabrics se alista para cerrar cientos de tiendas en todo el país, todas sus ubicaciones han comenzado a liquidar su inventario con grandes descuentos. Sin embargo, los seguidores de la otrora popular cadena de manualidades han criticado una política inesperada implementada durante las ventas de cierre.  La compañía compartió en redes sociales que ofrecería descuentos de entre el 40% y el 50% en sus productos como parte de la liquidación.  Esta medida llega después de que Joann, que se describe como ""el líder nacional en la categoría de costura y telas, con una de las mayores ofertas de artes y manualidades"", anunciara el cierre de cientos de tiendas tras su reciente declaración de bancarrota bajo el Capítulo 11. Todas las tiendas Joann iniciaron sus ventas de cierre el mes pasado luego de que se realizara una oferta ganadora en una subasta.  ""Tras un proceso de venta integral y una subasta, GA Group, junto con el Prepetition Term Loan Agent, ha sido seleccionado como el postor ganador para adquirir sustancialmente todos los activos de JOANN. En relación con este acuerdo, y sujeto a la aprobación del Tribunal de Quiebras, los postores ganadores planean comenzar la liquidación de las operaciones de la empresa y realizar ventas de cierre en todas las ubicaciones"", dijo Joann en un comunicado.  ""La dirección de JOANN, nuestra junta directiva, asesores y socios legales hicieron todos los esfuerzos posibles para buscar un resultado más favorable que permitiera mantener la empresa en funcionamiento. Estamos comprometidos a trabajar de manera constructiva con el comprador ganador para garantizar un cierre ordenado de las operaciones, minimizando el impacto en todas nuestras partes interesadas. Apreciamos profundamente a nuestros dedicados empleados, clientes y comunidades en todo el país por su inquebrantable apoyo durante más de 80 años"".  Sin embargo, mientras las tiendas siguen abiertas para las ventas finales, algunos compradores se han sorprendido con una nueva política que prohíbe el uso de tarjetas de regalo.  ""Solo quiero que sepan lo increíblemente frustrante que es que nos hayan quitado la posibilidad de usar tarjetas de regalo. Independientemente de que estén cerrando, su empresa aceptó dinero y ahora se niega a dar el producto a cambio. Está mal"", escribió un usuario en una publicación de la cadena en redes sociales."|Telemundo Chicago
La política transaccional en los Balcanes Occidentales en el segundo mandato de Trump|https://news.google.com/read/CBMiywFBVV95cUxNT2NHeDl3Nk1tVUViRXF6dEhpYUxIUWVOanU4NFpwMzk3VU1uOEttZnRMbHpxeHMtZ0x5SGc5czN0YTFsMzhQM1d4WnEtYmRaajNaMUN1Ti04Wk9IZ0JObUU3cGJxVGRtcEQ0WGl1NVd5d2o0TFppNFpFTFVlLTFLTUI4bFZpUms3NHRXYW1VY1R0cGI5YXBYSjdsdUg1UG10LUJsMGtncXJDVWxGSkZUNEtVcUVMU0xYamNVZ0VYcHowQ3FqSVAtREwtUQ?hl=es-419&gl=US&ceid=US%3Aes-419|  El planteamiento de la Unión Europea para los Balcanes Occidentales hace hincapié en la importancia que reviste mantener las iniciativas diplomáticas en favor de la ampliación. De 2014 a 2019, los esfuerzos de la Unión prácticamente no dieron fruto, sobre todo en lo tocante a las reformas del Estado de derecho. Este periodo entre 2014 y 2019, llamado “estabilocracia”, se caracterizó por el apoyo de la Unión Europea a los gobiernos locales a cambio de seguridad y estabilidad, pero esta situación mermó las iniciativas de reforma e incrementó el carácter puramente transaccional de las relaciones. Las tensiones entre Kosovo y Serbia y la situación política en Bosnia y Herzegovina persisten, lo que, sumado a la nueva presidencia de Trump, plantea el desafío a la Unión de mantener su credibilidad y garantizar la implantación de reformas significativas de cara al proceso de ampliación.   No disponible|Real instituto elcano
Paraguay: informe de coyuntura política|https://news.google.com/read/CBMibkFVX3lxTE5MdWdqTUVfaG1XN3dOOFQ5N3JZUDZfMnI2MVZyTGRxUVp2bnpwT1ZGNFdjbDNjRmFlbjZIemFkNDJpc1hkYUNtSDZaX2lDRWYyRm9QcnZTa2lwazZnQ3hFUGxNZTZ2MUNFcmlvc0RB?hl=es-419&gl=US&ceid=US%3Aes-419|Tras la sólida victoria del coloradismo en 2023, el presidente Santiago Peña y su mentor, Horacio Cartes, disfrutan de una gestión en la que la oposición política está muy mermada:
De un lado, el Partido Liberal Radical Auténtico (PLRA) aún no ha logrado recomponer su liderazgo, y el golpe de mano contra Efrain Alegre aún marca una interna que está lejos de ser resuelta.
En el campo de la izquierda, las fuerzas del otrora poderoso Frente Guasú siguen muy disminuidas, tanto como la salud de su líder histórico, Fernando Lugo.
Otros actores relevantes en la contienda electoral, como Paraguayo ‘Payo’ Cubas han visto cómo su bancada se desmembra, cooptada por el Gobierno.
A pesar de la debilidad, algunos actores y actrices apuntan ya la posibilidad de ser candidatos alternativos al coloradismo tanto para Asunción (en 2026): Soledad Núñez (ex candidata vicepresidencial con Efrain Alegre) o Johana Ortega (diputada del partido País Solidario -otrora Frente Guasú- junto al PLRA); como a las presidenciales de 2028, donde destaca Miguel Prieto, alcalde de Ciudad del Este.
El escenario electoral más próximo son las elecciones municipales que se celebrarán el 6 de octubre de 2026. El comando político de Honor Colorado ya ha comenzado a construir sus candidaturas, y con su enorme poder político y económico y ante los problemas de la oposición “se propone pintar el país de rojo’, en palabras del presidente del Partido Colorado, Horacio Cartes.
Las únicas tribulaciones de la hegemonía colorada vienen de la propia interna de su partido. Si bien Santiago Peña no ha dado muestras de querer autonomizarse de Cartes, lo cierto es que en algunas ocasiones se vislumbran fisuras en su hermandad. Se ha visto recientemente con el caso de la ministra Barán, a quien el cartismo quiere hacer pagar por la grave negligencia en la muerte de un recién nacido en Villarica. Peña, hasta ahora, se ha negado a cesarla.
